id,keyword,location,text,target
1,,,OUR DEEDS REASON EARTHQUAKE MAY ALLAH FORGIVE US,1
4,,,FOREST FIRE NEAR LA RONGE SASK CANADA,1
5,,,ALL RESIDENTS ASKED SHELTER PLACE NOTIFIED OFFICERS NO EVACUATION SHELTER PLACE ORDERS EXPECTED,1
6,,,13000 PEOPLE RECEIVE WILDFIRES EVACUATION ORDERS CALIFORNIA,1
7,,,JUST GOT SENT PHOTO RUBY ALASKA SMOKE WILDFIRES POURS SCHOOL,1
8,,,ROCKYFIRE UPDATE CALIFORNIA HWY 20 CLOSED DIRECTIONS DUE LAKE COUNTY FIRE CAFIRE WILDFIRES,1
10,,,FLOOD DISASTER HEAVY RAIN CAUSES FLASH FLOODING STREETS MANITOU COLORADO SPRINGS AREAS,1
13,,,IM TOP HILL I SEE FIRE WOODS,1
14,,,THERES EMERGENCY EVACUATION HAPPENING BUILDING ACROSS STREET,1
15,,,IM AFRAID TORNADO COMING AREA,1
16,,,THREE PEOPLE DIED HEAT WAVE FAR,1
17,,,HAHA SOUTH TAMPA GETTING FLOODED HAH WAIT A SECOND I LIVE IN SOUTH TAMPA WHAT AM I GONNA DO WHAT AM I GONNA DO FVCK FLOODING,1
18,,,RAINING FLOODING FLORIDA TAMPABAY TAMPA 18 19 DAYS IVE LOST COUNT,1
19,,,FLOOD BAGO MYANMAR WE ARRIVED BAGO,1
20,,,DAMAGE SCHOOL BUS 80 MULTI CAR CRASH BREAKING,1
23,,,WHATS MAN,0
24,,,I LOVE FRUITS,0
25,,,SUMMER LOVELY,0
26,,,MY CAR FAST,0
28,,,WHAT GOOOOOOOAAAAAAL,0
31,,,RIDICULOUS,0
32,,,LONDON COOL,0
33,,,LOVE SKIING,0
34,,,WHAT WONDERFUL DAY,0
36,,,LOOOOOOL,0
37,,,NO WAYI CANT EAT SHIT,0
38,,,WAS NYC LAST WEEK,0
39,,,LOVE GIRLFRIEND,0
40,,,COOOOL,0
41,,,DO LIKE PASTA,0
44,,,THE END,0
48,ablaze,Birmingham,BBCMTD WHOLESALE MARKETS ABLAZE,1
49,ablaze,Est. September 2012 - Bristol,WE ALWAYS TRY BRING HEAVY METAL RT,0
50,ablaze,AFRICA,AFRICANBAZE BREAKING NEWSNIGERIA FLAG SET ABLAZE ABA,1
52,ablaze,"Philadelphia, PA",CRYING SET ABLAZE,0
53,ablaze,"London, UK",ON PLUS SIDE LOOK AT THE SKY LAST NIGHT IT WAS ABLAZE,0
54,ablaze,Pretoria,PHDSQUARES MUFC THEYVE BUILT MUCH HYPE AROUND NEW ACQUISITIONS I DOUBT SET EPL ABLAZE SEASON,0
55,ablaze,World Wide!!,INEC OFFICE ABIA SET ABLAZE,1
56,ablaze,,BARBADOS BRIDGETOWN JAMAICA ÛÒ TWO CARS SET ABLAZE SANTA CRUZ ÛÓ HEAD ST ELIZABETH POLICE SUPERINTENDE,1
57,ablaze,Paranaque City,ABLAZE LORD D,0
59,ablaze,Live On Webcam,CHECK NSFW,0
61,ablaze,,OUTSIDE YOURE ABLAZE ALIVE YOURE DEAD INSIDE,0
62,ablaze,milky way,HAD AWESOME TIME VISITING CFC HEAD OFFICE ANCOP SITE ABLAZE THANKS TITA VIDA TAKING CARE US,0
63,ablaze,,SOOOO PUMPED FOR ABLAZE SOUTHRIDGELIFE,0
64,ablaze,,I WANTED SET CHICAGO ABLAZE PREACHING BUT HOTEL,0
65,ablaze,,I GAINED 3 FOLLOWERS LAST WEEK YOU KNOW STATS GROW,0
66,ablaze,"GREENSBORO,NORTH CAROLINA",HOW WEST BURNED THOUSANDS WILDFIRES ABLAZE CALIFORNIA ALONE,1
67,ablaze,,BUILDING PERFECT TRACKLIST LIFE LEAVE STREETS ABLAZE,0
68,ablaze,Live On Webcam,CHECK NSFW,0
71,ablaze,England.,FIRST NIGHT RETAINERS ITS QUITE WEIRD BETTER GET USED I WEAR EVERY SINGLE NIGHT NEXT YEAR LEAST,0
73,ablaze,"Sheffield Township, Ohio",DEPUTIES MAN SHOT BRIGHTON HOME SET ABLAZE,1
74,ablaze,India,MAN WIFE GET SIX YEARS JAIL SETTING ABLAZE NIECE,1
76,ablaze,Barbados,SANTA CRUZ ÛÓ HEAD ST ELIZABETH POLICE SUPERINTENDENT LANFORD SALMON R,0
77,ablaze,Anaheim,POLICE ARSONIST DELIBERATELY SET BLACK CHURCH IN NORTH CAROLINAÅÊABLAZE,1
78,ablaze,Abuja,NOCHES ELBESTIA ALEXISSANCHEZ HAPPY SEE TEAMMATES TRAINING HARD GOODNIGHT GUNNERS,0
79,ablaze,USA,KURDS TRAMPLING TURKMEN FLAG LATER SET ABLAZE OTHERS VANDALIZED OFFICES TURKMEN FRONT DIYALA,1
80,ablaze,South Africa,TRUCK ABLAZE R21 VOORTREKKER AVE OUTSIDE OR TAMBO INTL CARGO SECTION,1
81,ablaze,"Sao Paulo, Brazil",SET HEARTS ABLAZE EVERY CITY GIFT AND EVERY SKYLINE LIKE KISS UPON LIPS Û,0
82,ablaze,hollywoodland ,THEY SKY ABLAZE TONIGHT LOS ANGELES IM EXPECTING IG FB FILLED SUNSET SHOTS I KNOW PEEPS,0
83,ablaze,"Edmonton, Alberta - Treaty 6",HOW WEST BURNED THOUSANDS WILDFIRES ABLAZE CALIFORNIA ALONE CLIMATE ENERGY,1
85,ablaze,,REVEL WMV VIDEOS MEANS MAC FAREWELL ABLAZE WMV EN ROUTE DVD GTXRWM,0
86,ablaze,Inang Pamantasan,PROGRESSIVE GREETINGS IN MONTH STUDENTS WOULD SET PENS ABLAZE THE TORCH PUBLICATIONS,0
89,ablaze,Twitter Lockout in progress,RENE ABLAZE AMP JACINTA SECRET 2K13 FALLEN SKIES EDIT MAR 30 2013,0
91,ablaze,"Concord, CA",NAVISTA7 STEVE FIRES SOMETHING ELSE CALIFORNIA TINDERBOX CLOWN SETTING HOOD ABLAZE NEWS24680,1
92,ablaze,"Calgary, AB",NOWPLAYING RENE ABLAZE AMP IAN BUFF MAGNITUDE EDM,0
93,ablaze,Birmingham,NXWESTMIDLANDS HUGE FIRE WHOLESALE MARKETS ABLAZE,1
95,ablaze,San Francisco,ABLAZE TIME TALK GO I DONT KNOW I MAKE DUE WORK,0
96,accident,CLVLND,I CANT KIDS CUZ I GOT BICYCLE ACCIDENT AMP SPLIT TESTICLES IMPOSSIBLE KIDS MICHAEL YOU ARE THE FATHER,0
97,accident,"Nashville, TN",ACCIDENT I24 W NASHVILLETRAFFIC TRAFFIC MOVING 8M SLOWER USUAL,1
98,accident,"Santa Clara, CA",ACCIDENT CENTER LANE BLOCKED SANTACLARA US101 NB GREAT AMERICA PKWY BAYAREA TRAFFIC,1
100,accident,UK,HAD PERSONALINJURY ACCIDENT SUMMER READ ADVICE AMP SEE SOLICITOR HELP OTLEYHOUR,0
102,accident,"St. Louis, MO",STLOUIS CARACCIDENTLAWYER SPEEDING AMONG TOP CAUSES TEEN ACCIDENTS CAR ACCIDENT TEEÛ,0
104,accident,"Walker County, Alabama",REPORTED MOTOR VEHICLE ACCIDENT CURRY HERMAN RD NEAR STEPHENSON INVOLVING OVERTURNED VEHICLE PLEASE USE,1
105,accident,Australia,BIGRIGRADIO LIVE ACCIDENT AWARENESS,1
107,accident,North Carolina,I77 MILE MARKER 31 SOUTH MOORESVILLE IREDELL VEHICLE ACCIDENT RAMP CLOSED 86 118 PM,1
109,accident,,RT SLEEPJUNKIES SLEEPING PILLS DOUBLE RISK CAR ACCIDENT,0
110,accident,Norf Carolina,BY ACCIDENT KNEW GON HAPPEN,0
112,accident,"San Mateo County, CA",TRAFFIC ACCIDENT N CABRILLO HWYMAGELLAN AV MIR 080615 110358,1
113,accident,North Carolina,I77 MILE MARKER 31 40 SOUTH MOORESVILLE IREDELL VEHICLE ACCIDENT CONGESTION 86 118 PM,1
114,accident,"Njoro, Kenya",PASTOR SCENE ACCIDENTWHO OWNER RANGE ROVER,1
117,accident,,MOM DIDNT GET HOME FAST WISHED MOM ACCIDENT TRUCK SPILT MAYONNAISE,0
118,accident,Your Sister's Bedroom,I HORRIBLE CAR ACCIDENT PAST SUNDAY IM FINALLY ABLE GET AROUND THANK GOD,1
119,accident,,CAN WAIT SEE PISSED DONNIE I TELL I ANOTHER ACCIDENT,0
120,accident,"Arlington, TX",TRUCKCRASH OVERTURNS ON FORTWORTH INTERSTATE CLICK YOUVE CRASHGT,1
121,accident,"South Bloomfield, OH",ACCIDENT ASHVILLE US 23 SB SR 752 TRAFFIC,1
126,accident,,CAROLINA ACCIDENT MOTORCYCLIST DIES I540 CRASH WITH CAR THAT CROSSED MEDIAN A MOTORCYCLE RIDER TRAVELING,1
128,accident,"New Hanover County, NC",FYI CADFYI ACCIDENT PROPERTY DAMAGENHS999 PINER RDHORNDALE DR,1
129,accident,Maldives,RT NAAYF FIRST ACCIDENT YEARS TURNING ONTO CHANDANEE MAGU NEAR MMA TAXI RAMMED I HALFWAY TURNED EVERYONE CONFÛ,1
130,accident,"Manchester, NH",ACCIDENT LEFT LANE BLOCKED MANCHESTER RT 293 NB EDDY RD STOP GO TRAFFIC BACK NH3A DELAY 4 MINS TRAFFIC,1
131,accident,"Wilmington, NC",ACCIDENT PROPERTY DAMAGE PINER RDHORNDALE DR,1
132,accident,,ACCIDENT,0
133,accident,"New Hanover County, NC",FYI CADFYI ACCIDENT PROPERTY DAMAGEWPD1600 S 17TH ST,1
134,accident,,862015209 PM TRAFFIC ACCIDENT NO INJURY 2781 WILLIS FOREMAN RD,1
135,accident,global,AASHIQUI ACTRESS ANU AGGARWAL ON HER NEARFATAL ACCIDENT,1
136,accident,Alberta | Sask. | Montana,SUFFIELD ALBERTA ACCIDENT,1
137,accident,Charlotte,9 MILE BACKUP I77 SOUTHACCIDENT BLOCKING RIGHT 2 LANES EXIT 31 LANGTREE RDCONSIDER NC 115 NC 150 NC 16 ALTERNATE,1
138,accident,"Baton Rouge, LA",HAS ACCIDENT CHANGED LIFE WE HELP DETERMINE OPTIONS FINANCIALLY SUPPORT LIFE CARE PLANS ONGOING TREATMENT,0
139,accident,"Hagerstown, MD",BREAKING DEADLY MOTORCYCLE CAR ACCIDENT HAPPENED HAGERSTOWN TODAY ILL DETAILS 5 YOUR4STATE WHAG,1
141,accident,"Gloucestershire , UK",FLOWRI MARINADING ACCIDENT,0
143,accident,,CAR EVEN WEEK GOT FUCKING CAR ACCIDENT MFS CANT FUCKING DRIVE,1
144,accident,UK,NORWAYMFA BAHRAIN POLICE PREVIOUSLY DIED ROAD ACCIDENT KILLED EXPLOSION,1
145,accident,"Nairobi, Kenya",I STILL HEARD CHURCH LEADERS KENYA COMING FORWARD COMMENT ACCIDENT ISSUE DISCIPLINARY MEASURESARRESTPASTORNGANGA,0
146,aftershock,Instagram - @heyimginog ,AFTERSHOCKDELO SCUF PS LIVE GAME CYA,0
149,aftershock,304,THE MAN DRIVE EFFORT GETS PAINFUL MAN WIN ROGER BANNISTER,0
151,aftershock,Switzerland,320 IR ICEMOON AFTERSHOCK DJICEMOON DUBSTEP TRAPMUSIC DNB EDM DANCE ICESÛ,0
153,aftershock,304,THERE VICTORY BARGAIN BASEMENT PRICES DWIGHT DAVID EISENHOWER,0
156,aftershock,US,320 IR ICEMOON AFTERSHOCK DJICEMOON DUBSTEP TRAPMUSIC DNB EDM DANCE ICESÛ,0
157,aftershock,304,NOBODY REMEMBERS CAME SECOND CHARLES SCHULZ,0
158,aftershock,Instagram - @heyimginog ,AFTERSHOCKDELO IM SPEAKING SOMEONE USING SCUF XB1 PEOPLE END GETTING PS ALSO,0
159,aftershock,304,THE HARDER CONFLICT GLORIOUS TRIUMPH THOMAS PAINE,0
160,aftershock,,GROWINGUPSPOILED GOING CLAY PIGEON SHOOTING CRYING AFTERSHOCK,0
161,aftershock,Somewhere Only We Know ?,SO GUESS ONE ACTUALLY WANTS FREE AFTERSHOCK TC,0
162,aftershock,,AFTERSHOCK TERRIFYING BEST ROLLER COASTER IVE EVER DISCLAIMER IVE,0
163,aftershock,Belgium,AFTERSHOCK,0
164,aftershock,Switzerland,320 IR ICEMOON AFTERSHOCK DJICEMOON DUBSTEP TRAPMUSIC DNB EDM DANCE ICESÛ,0
165,aftershock,US,320 IR ICEMOON AFTERSHOCK DJICEMOON DUBSTEP TRAPMUSIC DNB EDM DANCE ICESÛ,0
168,aftershock,,320 IR ICEMOON AFTERSHOCK DJICEMOON DUBSTEP TRAPMUSIC DNB EDM DANCE ICESÛ,0
170,aftershock,dope show,KJFORDAYS IM SEEING ISSUES AFTERSHOCK,0
171,aftershock,Switzerland,320 IR ICEMOON AFTERSHOCK DJICEMOON DUBSTEP TRAPMUSIC DNB EDM DANCE ICESÛ,0
172,aftershock,Switzerland,320 IR ICEMOON AFTERSHOCK DJICEMOON DUBSTEP TRAPMUSIC DNB EDM DANCE ICESÛ,0
173,aftershock,"Oshawa, Canada",WISDOMWED BONUS 5 MINUTE DAILY HABITS COULD REALLY IMPROVE LIFE HOW MANY ALREADY LIFEHACKS,0
174,aftershock,Baker City Oregon,AFTERSHOCK PROTECT YOURSELF PROFIT NEXT GLOBAL FINANCIAL MELTDOWN DAVID WIEDEMER HTTP,0
175,aftershock,,THAT MOMENT GET SCARY ROLLER COASTER GUY BEHIND SCREAMING BLOODY MURDER SILVERWOOD AFTERSHOCK,0
176,aftershock,,AFTERSHOCK Ã¢ 2010 FULLÃ¢ STREAMING YOUTUBE,0
178,aftershock,United States,GTGT 15 AFTERSHOCK PROTECT YOURSELF PROFIT NEXT GLOBAL FINANCIAL BOOK ESQUIREATTIRE,0
180,aftershock,304,SOMETIMES FACE DIFFICULTIES YOURE SOMETHING WRONG YOURE SOMETHING RIGHT JOEL OSTEEN,0
182,aftershock,304,THE THING STANDS DREAM TRY BELIEF ACTUALLY POSSIBLE JOEL BROWN,0
183,aftershock,marysville ca ,PRAISE GOD MINISTRY TELLS LIKE WDYOUTH BIBLESTUDY,0
184,aftershock,304,REMEMBERING GOING DIE BEST WAY I KNOW AVOID TRAP THINKING SOMETHING LOSE ÛÒ STEVE JOBS,0
185,aftershock,"Hermosa Beach, CA",TRIED ORANGE AFTERSHOCK TODAY MY LIFE NEVER,0
187,aftershock,,ONFIREANDERS I LOVE BB,0
190,aftershock,,AFTERSHOCK,0
191,aftershock,,AFTERSHOCK BACK SCHOOL KICK GREAT I WANT THANK EVERYONE MAKING POSSIBLE WHAT GREAT NIGHT,0
193,aftershock,304,PEOPLE SAY CANNOT DONE INTERRUPT ÛÒ GEORGE BERNARD SHAW,0
194,aftershock,304,THE FIRST MAN GETS OYSTER SECOND MAN GETS SHELL ANDREW CARNEGIE,0
195,aftershock,,ANYONE NEED PU TONIGHT I PLAY HYBRID SLAYER PS4 EU HMU COD8SANDSCRIMS EMPIRIKGAMING CODAWSCRIMS 4TPKOTC 4TPFA AFTERSHOCKORG,0
196,airplane%20accident,"19.600858, -99.047821",EXPERTS FRANCE BEGIN EXAMINING AIRPLANE DEBRIS FOUND REUNION ISLAND FRENCH AIR ACCIDENT EXPERTS NEWS,1
197,airplane%20accident,Pennsylvania,STRICT LIABILITY CONTEXT AIRPLANE ACCIDENT PILOT ERROR COMMON COMPONENT AVIATION CR,1
198,airplane%20accident,"Salt Lake City, Utah",CROBSCARLA LIFETIME ODDS DYING AIRPLANE ACCIDENT 1 8015,0
199,airplane%20accident,"Palo Alto, CA",EXPERTS FRANCE BEGIN EXAMINING AIRPLANE DEBRIS FOUND REUNION ISLAND FRENCH AIR ACCIDENT EXPERTS WEDN,1
201,airplane%20accident,,ALEXALLTIMELOW THEYRE AIRPLANE ACCIDENT THEYRE GONNA DIE CUTIES GOOD JOB,1
203,airplane%20accident,"Spain but Opa-Locka, FL",FAMILY MEMBERS OSAMA BIN LADEN DIED AIRPLANE ACCIDENT IRONIC MHMMM GOV SHIT SUSPECT,1
204,airplane%20accident,"Jaipur, India",MAN GOES AIRPLANE ENGINE ACCIDENT VIA YOUTUBE,1
205,airplane%20accident,Hyderabad Telangana INDIA,HORRIBLE ACCIDENT MAN DIED IN WINGS AIRPLANE 29072015,1
208,airplane%20accident,"Eagle Pass, Texas",A CESSNA AIRPLANE ACCIDENT OCAMPO COAHUILA MEXICO JULY 29 2015 KILLED FOUR MEN INCLUDING STATE COAHUILA GOVERNMENT OFFICIAL,1
209,airplane%20accident,bangalore,HORRIBLE ACCIDENT MAN DIED IN WINGS AIRPLANE 29072015 WATCHTHEVIDEO,1
210,airplane%20accident,Financial News and Views,EXPERTS FRANCE BEGIN EXAMINING AIRPLANE DEBRIS FOUND REUNION ISLAND FRENCH AIR ACCIDENT EXPERTS WEDNESDAYÛ,1
211,airplane%20accident,,EXPERTS FRANCE BEGIN EXAMINING AIRPLANE DEBRIS FOUND REUNION ISLAND FRENCH AIR ACCIDENT EXPERTS WEDNESDAY BEGAN EXAMINING,1
212,airplane%20accident,Indonesia,KCA VOTEJKT48ID MBATAWEEL RIP BINLADEN FAMILY MEMBERS KILLED AIRPLANES ACCIDENT,1
213,airplane%20accident,y(our) boyfriends legs ,I ALMOST SENT COWORKER NUDES ACCIDENT THANK GOD AIRPLANE MODE,0
215,airplane%20accident,"New Mexico, USA",MICKINYMAN THEATLANTIC THAT MIGHT KILLED AIRPLANE ACCIDENT NIGHT CAR WRECK POLITICS BEST,0
216,airplane%20accident,Somewhere Out There,EXPERTS FRANCE BEGIN EXAMINING AIRPLANE DEBRIS FOUND REUNION ISLAND FRENCH AIR ACCIDENT EXPERTS MLB,1
218,airplane%20accident,,THIS UNBELIEVABLY INSANE MAN AIRPORT AIRPLANE AIRCRAFT AEROPLANE RUNWAY ACCIDENT FREAKYÛ,1
219,airplane%20accident,Mumbai india,HORRIBLE ACCIDENT MAN DIED IN WINGS AIRPLANEÅÊ29072015,1
220,airplane%20accident,sri lanka,HORRIBLE ACCIDENT MAN DIED IN WINGS AIRPLANE 29072015,1
221,airplane%20accident,Not a U.S resident,USAMA BIN LADINS FAMILY DEAD AIRPLANE CRASH NATURALLY ACCIDENT,1
222,airplane%20accident,,PILOT DIES IN PLANE CRASH AT CAR FESTIVAL VIA YOUTUBE CRASH AIRCRAFT AIRPLANE PILOT DEATH ACCIDENT CARFEST,1
225,airplane%20accident,"Lehigh Valley, PA",STRICT LIABILITY CONTEXT AIRPLANE ACCIDENT,1
226,airplane%20accident,Canada,DTN BRAZIL EXPERTS FRANCE BEGIN EXAMINING AIRPLANE DEBRIS FOUND REUNION ISLAND FRENCH AIR ACCIDENT EXP,1
229,airplane%20accident,,EXPERTS FRANCE BEGIN EXAMINING AIRPLANE DEBRIS FOUND REUNION ISLAND FRENCH AIR ACCIDENT EXPERTS WEDN,1
231,airplane%20accident,Thrissur,HORRIBLE ACCIDENT MAN DIED IN WINGS OF ÛÏAIRPLANEÛ 29072015 WTF YOU CANÛªT BELIEVE YOUR EYES ÛÒ,1
232,airplane%20accident,Havenford,NICOLE FLETCHER ONE VICTIM CRASHED AIRPLANE TIMES AGO THE ACCIDENT LEFT LITTLE BIT TRAUMA ALTHOUGH SHES,1
235,airplane%20accident,India,OMG HORRIBLE ACCIDENT MAN DIED WINGS AIRPLANE,1
237,airplane%20accident,92,OMG I DONT BELIEVE RIP BRO AIRPLANE ACCIDENT JETENGINE TURBOJET BOING G90,1
238,airplane%20accident,,EXPERTS FRANCE BEGIN EXAMINING AIRPLANE DEBRIS FOUND REUNION ISLAND FRENCH AIR ACCIDENT EXPERTS WEDNESDAY BEGAN EXAMINING,1
240,airplane%20accident,Israel,I AIRPLANE ACCIDENT,1
241,airplane%20accident,Fashion Heaven. IG: TMId_,MY PHONE LOOKS LIKE CAR SHIP AIRPLANE ACCIDENT TERRIBLE,0
242,airplane%20accident,"San Francisco, CA",STATISTICALLY IM RISK GETTING KILLED COP I DYING AIRPLANE ACCIDENT,0
243,airplane%20accident,italy,AIRPLANE CRASHES HOUSE COLOMBIA 12 PEOPLE DIE ACCIDENT,1
244,airplane%20accident,nyc,THE SHOOTING AIRPLANE ACCIDENT,1
245,airplane%20accident,Toronto,COULD DRONE CAUSE AIRPLANE ACCIDENT PILOTS WORRIED USE DRONES ESP CLOSE VICINITY AIRPORTS,1
246,ambulance,,EARLY WAKE CALL SISTER BEGGING COME AMP RIDE WHER AMBULANCE HOSPITAL RODKIAI,1
247,ambulance,Jackson,TWELVE FEARED KILLED PAKISTANI AIR AMBULANCE HELICOPTER CRASH,1
248,ambulance,New York / Worldwide,TWO AIR AMBULANCES SCENE SERIOUS CRASH TWO CARS LORRY EMSNEÛ,1
249,ambulance,,TWELVE FEARED KILLED PAKISTANI AIR AMBULANCE HELICOPTER CRASH REUTERS YUGVANI,1
251,ambulance,"New Orleans, LA",LEADING EMERGENCY SERVICES BOSS WELCOMES NEW AMBULANCE CHARITY,0
252,ambulance,West Wales,ANYONE TRAVELLING ABERYSTWYTHSHREWSBURY RIGHT THERES INCIDENT SERVICES HALT OUTSIDE SHREWS AMBULANCE SCENE,1
253,ambulance,,TWELVE FEARED KILLED PAKISTANI AIR AMBULANCE HELICOPTER CRASH,1
254,ambulance,Happily Married with 2 kids ,AMBULANCE SPRINTER AUTOMATIC FRONTLINE VEHICLE CHOICE OF 14 LEZ COMPLIANT EBAY,0
256,ambulance,"Cambridge, MA",NEW NANOTECH DEVICE WILL BE ABLE TO TARGET AND DESTROY BLOOD CLOTS,0
258,ambulance,Arizona ,20SKYHAWKMM20 TRAPLORD29 FREDOSANTANA300 LILREESE300 HELLA CRAZY 3 FIGHTS AMBULANCE COUPLE MOSH PITS,1
260,ambulance,Mumbai,IF I GET RUN AMBULANCE I LUCKY JUSTSAYING RANDOMTHOUGHT,0
261,ambulance,,NEWS TWELVE FEARED KILLED PAKISTANI AIR AMBULANCE HELICOPTER CRASH TILNOW DNA,1
262,ambulance,Amsterdam,TWELVE FEARED KILLED PAKISTANI AIR AMBULANCE HELICOPTER CRASH,1
263,ambulance,"Swindon,England ",TANSLASH WAITING AMBULANCE,0
264,ambulance,,FOUSEYTUBE OK NEED AMBULANCE HAHAHAH GOOD,0
265,ambulance,Happily Married with 2 kids ,AMBULANCE SPRINTER AUTOMATIC FRONTLINE VEHICLE CHOICE OF 14 LEZ COMPLIANT EBAY,0
266,ambulance,,PAKISTAN AIR AMBULANCE HELICOPTER CRASH KILLS NINE,1
267,ambulance,"Williamstown, VT",THENISSONIAN REJECTDCARTOONS NISSAN OK NEED MEDICAL ASSISTANCE CALL AMBULANCE NEED,0
268,ambulance,"North Carolina, USA",EMS1 NY EMTS PETITION 17 PER HOUR Û÷MINIMUM WAGEÛª EMS PARAMEDICS AMBULANCE,0
269,ambulance,,TWELVE FEARED KILLED PAKISTANI AIR AMBULANCE HELICOPTER CRASH,1
270,ambulance,Karachi,TWELVE FEARED KILLED PAKISTANI AIR AMBULANCE HELICOPTER CRASH,1
271,ambulance,Happily Married with 2 kids ,AMBULANCE SPRINTER AUTOMATIC FRONTLINE VEHICLE CHOICE OF 14 LEZ COMPLIANT EBAY,0
272,ambulance,Happily Married with 2 kids ,AMBULANCE SPRINTER AUTOMATIC FRONTLINE VEHICLE CHOICE OF 14 LEZ COMPLIANT EBAY,0
273,ambulance,Loveland Colorado,KIWIKARYN CHECK WHATS PARKING LOT HE SAID LAST YEAR AMBULANCE ST JOHNS,0
274,ambulance,|| c h i c a g o ||,DONT KNOW WAY AMBULANCE COMING LTLT,1
276,ambulance,,REUTERS TWELVE FEARED KILLED PAKISTANI AIR AMBULANCE HELICOPTER CRASH,1
277,ambulance,L. A.,TWELVE FEARED KILLED PAKISTANI AIR AMBULANCE HELICOPTER CRASH,1
279,ambulance,,WHY AMBULANCE RIGHT OUTSIDE WORK,0
280,ambulance,Canada,ÛÏLEOBLAKECARTER THIS DOG THINKS HES AMBULANCE,0
281,ambulance,VISIT MY YOUTUBE CHANNEL.,HAPPENING NOW HATZOLAH EMS AMBULANCE RESPONDING WITH DUAL SIRENS ANDÛ,0
283,ambulance,Lexington,TWELVE FEARED KILLED PAKISTANI AIR AMBULANCE HELICOPTER CRASH,1
285,ambulance,,TWELVE FEARED KILLED PAKISTANI AIR AMBULANCE HELICOPTER CRASH,1
287,ambulance,USA,TWELVE FEARED KILLED PAKISTANI AIR AMBULANCE HELICOPTER CRASH WORLDNEWS,1
289,ambulance,"Hannover, Germany",TWELVE FEARED KILLED PAKISTANI AIR AMBULANCE HELICOPTER CRASH WORLDNEWS,1
290,ambulance,,WHATS POLICE AMBULANCE NUMBER LESOTHO ANY BODY KNOW,0
291,ambulance,,MEDIC914 AACEORG I SURPRISED STILL CANNOT STANDARDISED CLINICAL PRACTICE ACROSS 11 NHS AMBULANCE TRUST,0
293,ambulance,Playa,TWELVE FEARED KILLED PAKISTANI AIR AMBULANCE HELICOPTER CRASH,1
294,ambulance,"Davidson, NC",PEOPLE TRY JWALK AMBULANCE PASSING I HATE,0
296,annihilated,Higher Places,THE EPISODE TRUNKS ANNIHILATED FREIZA CLEANEST SHIT EVER HE SHOWED NIGGA MERCY,0
297,annihilated,"Horsemind, MI",THEY SHALL BE ANNIHILATED AND ALL OF THEIR PETEBESTS DESSICATED AND LAID BARE THEN YOU SHALL KNEEL BEFORE ME,0
298,annihilated,"New York, NY",URIBE ANNIHILATED BASEBALL METS,0
299,annihilated,Boksburg,MARKSMAPONYANE HEYSUNDOWNS ANNIHILATED PREVIOUS MEETING CELTICINDEED IMPROVEMENT,0
301,annihilated,,VOLFAN326 TNEAZZY MIZZOU ANNIHILATED FLORIDA PAST 2 SEASONS EVEN ENDED MUSCHAMPS CAREER CANT COMPETE BAMA,0
302,annihilated,,ANNIHILATED ABS,1
303,annihilated,,BE ANNIHILATED STATUS EDUCATION MBA BEHALF EASY STREET CAREEN EOVM,0
307,annihilated,"V-RP @OZRP_ ?MV, AU, R18+?",LUKA THEY DIE ALL EVERYTHING ANNIHILATED ALOIS TRANCY,0
309,annihilated,"Greater Manchester, UK",ACAREWORNHEART HAVE GOOD UN FELLA SORRY I WONT GET ANNIHILATED,0
310,annihilated,Boston,COP PULLS DRUNK DRIVER SAFETY SECONDS CAR HIT TRAIN VIA VIRALSPELL,1
312,annihilated,,YOU MUST ANNIHILATED,0
313,annihilated,,COP PULLS DRUNK DRIVER SAFETY SECONDS CAR HIT TRAIN VIA VIRALSPELL,1
314,annihilated,The Canopy Kingdom,BOOM YOUR COUNTRY ENTIRELY ANNIHILATED HÛ ÛÓ BRITAIN,0
315,annihilated,,AMIRKINGKHAN WOULD ANNIHILATED MIGHT WELL THANK FLOYDMAYWEATHER,0
316,annihilated,USA,ONE THING SUREGOD PROMISED ISRAEL ANNIHILATED BUTTHE HORROR IRAN WNUKES,0
318,annihilated,,VIOLENTFEMINAZI I GUESS THATS OK ARMENIANS SINCE WEVE SPENT HISTORY GETTING ANNIHILATED,1
320,annihilated,,70 YEARS SINCE ANNIHILATED 100000 PEOPLE INSTANTLY BECAME AWARE ABILITY ANNIHILATE WHOLE HUMANITY,1
321,annihilated,the own zone layer ,DAY 1 TRYOUTS WENT GOOD MINUS FACT I STOPPED QUICKLY GET SHORT BALL ANNIHILATED TOENAIL INJURY EVEN,0
322,annihilated,London,DURING 1960S ORYX SYMBOL ARABIAN PENINSULA ANNIHILATED HUNTERS,1
327,annihilated,Trancy Manor,TO LUKA THEY DIE ALL EVERYTHING ANNIHILATED ALOIS TRANCY,0
328,annihilated,,READY GET ANNIHILATED BUCS GAME,1
329,annihilated,South 37,PHILIPDUNCAN BREAKFASTONE PEOPLE ANNIHILATED LAST NIGHTS WEATHER REALLY PHILIP THOUGHT WOULD FORECAST,1
330,annihilated,,DOMAIN SOPHISTICATION ANNIHILATED CLOSELY UPTOTHEMINUTE FEAT ZRNF,0
331,annihilated,"West Lancashire, UK.",STORMBEARD STEELLORD I SEEN JUDAS PRIEST 2005 ROB CAME BACK SCORPIONS SUPPORT FUCKING ANNIHILATED PLACE ASTONISHING GIG,0
332,annihilated,PA,OFFICIALLY SKIPPING FANTASTICFOURFANT4STICWHATEVER HASHTAG ITS GETTING ANNIHILATED REVIEWS BUMMER,0
334,annihilated,,TOMCATARTS THUS EXPLAINING ANNIHILATED BUT CASE SURVIVOR EVOLVED BECAME GODLIKE,1
335,annihilated,Û¢ Views From The Six Û¢,COMPLETELY ANNIHILATED CECH PAUL KEEGAN TIME ALIVE,0
336,annihilated,,TOMCATARTS ANNIHILATED LEGION THE SURVIVORS IMPERFECT HYBRID PROJECT QUICKLY FORMED NEW SECRET CELL,0
337,annihilated,University of Toronto,SIRBRANDONKNT EXACTLY THATS LESNARCENA MATCH SUMMERSLAM LAST YEAR GREAT BROCK ANNIHILATED GUY WHOS,0
338,annihilated,,COP PULLS DRUNK DRIVER SAFETY SECONDS CAR HIT TRAIN VIA VIRALSPELL,1
340,annihilated,Swaning Around,ANNIHILATED IN DAMASCUS SYRIAN ARMY GRINDS Û÷ALLOOSH AND HIS GANG INTO THE MANURE PILE,1
341,annihilated,,THATDES OK WASNT COMPLETELY FORTHRIGHT MAY ALSO FOOD COMA BC KEBABTAHINIPICKLES ALSO ANNIHILATED WFRIES,0
344,annihilated,London,A FUN FILLED HAPPYHOUR SIMMONS BAR CAMDEN HANDSOME ONE I GOT ANNIHILATED APART GAME,0
345,annihilated,Albany/NY,JUANNY BEISBOL SR ANNIHILATED BALL LGM,0
346,annihilation,"California, USA",RVFRIEDMANN HELL FRACTION BELIEF TOTAL ANNIHILATION DESTRUCTION USA LODISILVERADO RITZYJEWELS,1
347,annihilation,,POTUS MAYBE CALL ISRAEL TELL SORRY PRES SOLD RIVER ANNIHILATION,0
348,annihilation,,EVILDEAD ANNIHILATION CIVILIZATION,0
349,annihilation,,US NATIONAL PARK SERVICES TONTO NATIONAL FOREST STOP ANNIHILATION SALT RIVER WILD HORSE VIA CHANGE,0
352,annihilation,Wild Wild Web,ANNIHILATING QUARTERSTAFF ANNIHILATION,1
353,annihilation,Subconscious LA,WORLD ANNIHILATION VS SELF TRANSFORMATION ALIENS ATTACK EXTERMINATE HUMANS,0
354,annihilation,Spain,STARMADE STARDATE 3 PLANETARY ANNIHILATION VIA YOUTUBE,1
355,annihilation,,US NATIONAL PARK SERVICES TONTO NATIONAL FOREST STOP ANNIHILATION SALT RIVER WILD HORSE VIA CHANGE,0
356,annihilation,CA physically- Boston Strong?,US NATIONAL PARK SERVICES TONTO NATIONAL FOREST STOP ANNIHILATION SALT RIVER WILD HORSE VIA CHANGE,1
358,annihilation,"Yeezy Taught Me , NV",KIMKARDASHIAN PLEASE SIGN SHARE PETITION SAVE WILD HORSES ARIZONA,0
360,annihilation,,US NATIONAL PARK SERVICES TONTO NATIONAL FOREST STOP ANNIHILATION SALT RIVER WILD HORSE VIA CHANGE,1
361,annihilation,CA physically- Boston Strong?,THEELLENSHOW PLEASE CHECK SALT RIVER HORSES HELP STOP ANNIHILATION HAPPEN WITHOUT 54000 SIGNATURESCHANGE ORG THX,0
363,annihilation,United States,ARE SOULS PUNISHED WITHÅÊANNIHILATION,0
364,annihilation,,CALFREEDOMMOM STEPH93065 MENTION MAJOR CONTRIBUTOR ANNIHILATION ISRAEL,1
365,annihilation,,WILLIENELSON WE NEED HELP HORSES DIEPLEASE RT AMP SIGN PETITIONTAKE STAND AMP VOICE GILBERT23,1
368,annihilation,"Rock Hill, SC",I REJECT LAWS MISGUIDED FALSE PROPHETS IMPRISON NATIONS FUELING SELF ANNIHILATION,0
370,annihilation,"Coolidge, AZ",US NATIONAL PARK SERVICES TONTO NATIONAL FOREST STOP ANNIHILATION SALT RIVER WILD HORSE VIA CHANGE,0
371,annihilation,Republic of Texas,THE ANNIHILATION JEB CHRISTIE AMP KASICH LESS 24 HOURS AWAY PLEASE GOD ALLOW LEAST ONE FULL DAY,0
372,annihilation,,BARBITWINS WE NEED HELPHORSES DIE PLEASE RT AMP SIGN PETITION TAKE STAND AMP VOICE GILBERT23,0
375,annihilation,,WHIPPENZ WE NEED HELP HORSES DIEPLEASE RT AMP SIGN PETITIONTAKE STAND AMP VOICE GILBERT23,0
380,annihilation,"Phoenix, AZ",HEY AZ SIGN PETITION SAVE WILDHORSES TANTONATIONALFOREST A ROLLINGSTONES SINGALONG ORDER,0
381,annihilation,"Ljubljana, Slovenia",STOP ANNIHILATION SALT RIVER WILD HORSES VIA CHANGE,1
383,annihilation,Connecticut,SONOFBALDWIN HES CURRENT NOVA BOOKSLAST I CHECKEDHE TIED BOOKS 2011 RIDER DIED ANNIHILATION,0
384,annihilation,"Tacoma,Washington",US NATIONAL PARK SERVICES TONTO NATIONAL FOREST STOP ANNIHILATION SALT RIVER WILD HORSE VIA CHANGE,0
386,annihilation,,PLEASE SIGN AMP RT SAVE SALTRIVERWILDHORSES,0
389,annihilation,,THANKS COUNT DANTE DO JOIN US BY FOLLOWING THE ANNIHILATION ZONE JOHNNY,0
390,annihilation,Subconscious LA,WORLD ANNIHILATION VS SELF TRANSFORMATION ALIENS ATTACK EXTERMINATE HUMANS,1
393,annihilation,BIG D  HOUSTON/BOSTON/DENVER,US NATIONAL PARK SERVICES TONTO NATIONAL FOREST STOP ANNIHILATION SALT RIVER WILD HORSE VIA CHANGE,0
394,annihilation,"Chandler, AZ",US NATIONAL PARK SERVICES TONTO NATIONAL FOREST STOP ANNIHILATION SALT RIVER WILD HORSE VIA CHANGE,1
396,apocalypse,ColoRADo,IM GONNA FIGHT TAYLOR SOON I GET,0
397,apocalypse,sindria,OHH NO FUKURODANI DIDNT SURVIVE THE APOCALYPSE BOKUTO FEELS HORRIBLE POOR BOY PPOR CHILD,1
398,apocalypse,,ANOTHER JOCELYN BIRTHDAY APOCALYPSE,0
401,apocalypse,,RT JANENELSON097 RT STEPHENSCIFI ADAPTATION WATCH CHARLIE HUMANS APOCALYPSE NOW NOW OPTIONED FILM SCIENCEFICTION Û,0
402,apocalypse,Texas,APOCALYPSE PLEASE,0
404,apocalypse,"Elk Grove, CA, USA",ANOTHER HOUR ITS AUGUST 05 2015 0802PM HERES RED ROVER ZOMBIE APOCALYPSE 2014 INTERNETRADIO COLLEGERADIÛ,1
406,apocalypse,Texas,HONEYBUNZGEM PRIMALKITCHEN I FEEL LIKE PULLUP ONE STAGES APOCALYPSE,0
407,apocalypse,,SHES KINDA HOT PLAYED RADIO TODAY WHATS NEXT DISEASE THE APOCALYPSE STARTED EVERYONE BE CAREFUL,0
409,apocalypse,The Shire,BUT APOCALYPSE LOL GF M8,0
