id,keyword,location,text,target
2743,crushed,,SO MANY YOUTUBE COMMENTERS SAYING DOTHRAKI WOULD GET CRUSHED CAME WESTEROSNAH BRO UNDERESTIMATE DOTHRAKI,1
2744,crushed,Trinidad & Tobago,DISILLUSIONED LEAD CHARACTER CHECK HAPPY GO LUCKY FREE SPIRIT GIRL CHECK DREAM LIFE CRUSHED CHECK GREAT MUSIC CHECK ALL CROWE TROPES INTACT,0
2748,crushed,Chicago - Lake Buena Vista,REMEMBER NORA JONES CRUSHED TWO WEEKS NOTICE,0
2749,crushed,"Toronto, Ontario",HOW EMPIRE AVENUE CRUSHED SOUL VIA MARKWSCHAEFER,0
2752,crushed,"Liberty Lake, WA",13 M CHAPOUTIER CROZES HERMITAGE MUCH PURPLE VIOLETS SLATE CRUSHED GRAVEL WHITE PEPPER YUM FRANCE WINE DC,0
2753,curfew,,THECOMEDYQUOTE 50SHADEZOFGREY THIRST CURFEW P45PEREZ,0
2755,curfew,Ankara - Malatya - ad Orontem,ARA NEWS REPORTING JAN FIGHTERS INFILTRATED ASHRAFIYAH DISTRICT AFRIN AIM CARRYING SUICIDE ATTACKS YPG IMPOSED CURFEW,1
2756,curfew,,KEAMPURLEY THIRST CURFEW,0
2757,curfew,,AND FACT CURFEW,0
2758,curfew,"antioch, california",MICHELLEELLLE SHUT FRESHMAN PAST UR CURFEW U NEED SLEEP U SPEND MUCH UR TIME WATCHING TV INSTEAD GOING OUTSIDE,0
2759,curfew,"State College, PA",IS NIGHT CURFEW CAMPUS FIND,0
2760,curfew,"Chicago, IL",POLICE TEENAGERS ARRESTED CURFEW VIOLATIONS EVANSTON RIDING STOLEN BICYCLES TWO TEENAGERS TAKEN CUS CHICAGO NEWS,1
2761,curfew,,REASON IM LISTENING CURFEW OVERTIME STUCK KODAK,0
2763,curfew,somewhere in cali ,BOBBYXFISHER I SHOULDVE GAVE CURFEW,0
2765,curfew,Im Around ... Jersey,CURFEW REALLY HELPS IF THINK BC,0
2766,curfew,Garden Grove,EXOFFICIO MENS BOXER BRIEF CURFEW LARGE,0
2767,curfew,"Adelaide, Australia",INFO S WND 0306 CLD SCT014 BKN032 EXP INST APCH RWY 05 CURFEW IN OPER UNTIL 2030 Z TAXIWAYS FOXTROT 5 AMP FOXTROT 6 NAVBL TMP 10,0
2768,curfew,,EMAAALAY THANK I DONT CITY WIDE CURFEW,0
2769,curfew,,SHE SAID CURFEW NOPE,0
2770,curfew,BKI-KUA,HER CURFEW START RIGHT PRIVATE CLASS ENDS TUTOR MUST WOMAN PREFERABLY SOMEONE 50,0
2771,curfew,,APTLYENGINEERD THERE CURFEW,0
2773,curfew,urÌ£nus,IT PAST CURFEW GROVE,0
2774,curfew,"Illinois, USA",EMMYCHAPPY BECAUSE 12 OCLOCK MOM SAID EVERYONE GO HOME CURFEW,1
2777,curfew,A.A.S my Aztec Princess,REDDAKUSHGODD SAID MONTHS BUT I GET CURFEW TIME SMFH,0
2778,curfew,turner fenton,BALL CURFEW,0
2780,curfew,,SCOTRAIL SEEN TURN BLIND EYE BLOKE DRINKING SMOKING CURFEW TIME COSITS WORTH HASSLE,1
2782,curfew,"KLA,Uganda",NEXT MAY ILL FREEFROM SCHOOL OBLIGATIONS LIKE FAMILY BEST DAMN CURFEW,1
2783,curfew,Uganda,DAVISKAWALYA I KNOW MAURYN143 SAYING FINAL GOODBYES GRANDPA SEEN NEWS RIP ME ALWAYS OPEN IDEAS MAY CURFEW,0
2784,curfew,,PEOPLE REALLY STILL CURFEW EVEN THEYRE 18 AMP GRADUATED HIGH SCHOOL,0
2785,curfew,253,STUPIDNIGGR IM TELLING MOM PAST CURFEW OTH,0
2786,curfew,"Elkhart, IN",HAD CANCEL CATS DOCTOR APPOINTMENT DECIDED GO PLAY COME HOME CURFEW,0
2787,curfew,"Adelaide, Australia",INFO R CURFEW IN OPER UNTIL 2030 Z TAXIWAYS FOXTROT 5 AMP FOXTROT 6 NAVBL WND 0605 EXP INST APCH RWY 05 DAMP TMP 10 QNH 1028,0
2788,curfew,California,BUT LIES THOUGH ITS PAYS OLDEST SOMETIMES LIKE FIRST GET CAR CURFEW FREEDOM DONTHATE,0
2792,curfew,"Adelaide, Australia",INFO U CLD SCT012 BKN025 EXP INST APCH RWY 05 CURFEW IN OPER UNTIL 2030 Z TAXIWAYS FOXTROT 5 AMP FOXTROT 6 NAVBL TMP 10 WND 0306,0
2793,curfew,Pon Di Gully,RITE MAN TLK WIDOUT NUH CURFEW LONG SIDE AKA CUM FI STEAL DI SHOW ITZ RUBBERY DI WHOLE DEM FI KNW SOUND MUSIC,0
2794,curfew,Benedict College,DONT EVEN COME WORRIED CURFEW BC19,0
2795,curfew,HTX,YOU GOT WHOLE CURFEW,0
2796,curfew,,WHEN YOURE 5 HOURS LATE CURFEW PRAY DOG DOESNT BARK UNLOCKING DOOR,0
2797,curfew,IM LOST ,DA JUDGE GAVE DIS GIRL 5PM CURFEW,0
2799,curfew,Miami,IN BEGINNING SUMMER MOM MADE CURFEW 1 BACK 12 I NEVER GO WONDERS IM ALWAYS HOME,0
2801,curfew,,WHY CHARLIE LIM START 9PM SUNDAY I CURFEW LEH,0
2802,curfew,"Hamilton, ON",WHEN U BOMBED AND U TRY 2 GET HOME FOR CURFEW,0
2803,cyclone,United Kingdom,BABY WALTER REWATCHINGTHEPILOT TEAMSCORPION CYCLONE,0
2807,cyclone,"Des Moines, Iowa ",THE BIG TEN ANNUAL FOOTBALL MEDIA DAY GET HERES CYCLONE HOOPS RECRUITING NUGGETS,1
2808,cyclone,USA,CAMERA ART PHOTOGRAPHY 0215 NEW BOLTÅÊCYCLONE DR PP400DR DUAL OUTLET POWER PACKÅÊFOR EXTERNAL CAMERA FLASH 30Û,0
2811,cyclone,Rural Northern Nevada,MCCAULEYSDESIGN ABYSMALJOINER DYAMIPLOTKE WORKS PURPOSE A LARGE CYCLONE WOULD BETTER I DONT 4K THIS 500,0
2813,cyclone,Republic of the Philippines,A NEW TROPICAL CYCLONE FORMING NEAR GUAM ONCE FORMED CALLED MOLAVE,1
2815,cyclone,,VIDEO NEW DE JHAUSTIN THOMAS CYCLONE AMES TRIBUNE AMES TRIBUNE VIDEO NEW DE JHAUSTIN THOMAS ONÛ,0
2817,cyclone,,XHNEWS WE NEED PLANTS PACIFIC CYCLONE SEASONS WOULD HELP,1
2819,cyclone,,BBC FORCED TO RETRACT FALSE CLAIMS ABOUT CYCLONE PAM VIA WORDPRESSDOTCOM,1
2820,cyclone,,GREAT CONDITION EASTON CYCLONE SOFTBALL BAT FASTPITCH 9 2920 SK398,1
2821,cyclone,Philippines ,SEVERE WEATHER BULLETIN NO 5 FOR TYPHOON ÛÏHANNAPHÛ SOUDELOR TROPICAL CYCLONE WARNING ISSUED AT 500 PM 06,1
2822,cyclone,"Washington, DC",THE CYCLONE DERIVES POWERS CALM CENTER SO PERSON NORMAN VINCENT PEALE,1
2825,cyclone,hyderabad,ROUGHDEAL1 ANTE HUDHUD CYCLONE CHANDRABABU VALLE NE ANTE GA,1
2826,cyclone,Vancouver (HQ) and worldwide,CYCLONE KOMEN DEVASTATES FAMILIES MYANMAR WEEK WE NEED HELP TODAY,1
2827,cyclone,"Quezon City, Philippines",SEVERE WEATHER BULLETIN 6 TROPICAL CYCLONE WARNING TYPHOON HANNA ISSUED 1100 PM THURSDAY 06 AUGUST,1
2828,cyclone,Geneva,BACK FUTURE VANUATU CYCLONE PAM ENCOURAGED TRADITIONAL WAYS LIVING,1
2829,cyclone,"Hartford,  connecticut",BANK MANAGER ASKS TOM INTERVIEW WHAT CYCLONE TOM IT LOAN GIVEN PURCHASE BICYCLE,0
2830,cyclone,"Sioux Falls, SD",EXCITED CYCLONE FOOTBALL,0
2831,cyclone,Cornwall,BBC FORCED TO RETRACT FALSE CLAIMS ABOUT CYCLONE PAM VIA WORDPRESSDOTCOM,1
2832,cyclone,Beside Basketball,TALENT MISDIRECTION CYCLONE PASS IGNITE PASS VANISHING DRIVE PHANTOM SHOT KUROKOBOT,1
2833,cyclone,"Rome, Italy",NOW COMDEV ASIA RADIO STATIONS BANGLADESH BROADCASTING PROGRAMS ADDRESS UPCOMING CYCLONE KOMEN,1
2835,cyclone,Tafekop Ga-Matsepe,LIKE CYCLONE IMPERIALISM SPINS ACROSS GLOBE MILITARISM CRUSHES PEOPLES SUCKS BLOOD LIKE,1
2836,cyclone,,1970 MERCURY CYCLONE GT HOOD MOULDING VERY NICE CORE COBRA JET 429CJ GT,0
2838,cyclone,,IM CYCLONE PASSION OVERBLOWN,0
2839,cyclone,,HIS MAJESTY EMPEROR SALMAN KHANS UNSTOPPABLE CYCLONE OF ENTERTAINMENT HUMANITY BAJRANGI BHAIJAAN CREATING HISTORY EVERYWHERE CROSED 300 CR,0
2841,cyclone,,1970 MERCURY CYCLONE GT QUARTER PANEL DS REAR TRIM MOULDING COBRA JET 429CJ,1
2842,cyclone,,TROPICAL CYCLONE INFO SOUDELOR 945HPA MAXIMUM WIND SPEED 45MS MAXIMUM WIND GUST SPEED 60MS,1
2843,cyclone,Melbourne,CYCLONEREIZEI IF I MAY ASK CYCLONESAMA READ JAILED FATE RINDOU,0
2844,cyclone,Vilnius,SOME DRUGS ALCOHOL JACKSON VROMAN HOUSE,0
2846,cyclone,Geneva,BLENDING OLD NEW VANUATU PREPARE FUTURE EMERGENCIES,0
2849,cyclone,,WFP WFP DELIVERS FOOD TO 165000 BANGLADESH FLOOD VICTIMS AFTER TROPICAL CYCLONE KOMEN DHAKA ÛÒTHE UNITED NA,1
2851,cyclone,,ROHINGYA HOUSES KYEE NOCKTHIE HAMLET TAUNGBAZAR REGION BUTHIDAUNG SEVERELY DAMAGED CYCLONE KASITAROCH VIVIANUNHCR,1
2852,cyclone,Made in America,CYCLONE DOUBLE G WOULD CHERRY TOP OUTFIT OOTD DOUBLEGHATS,0
2853,damage,"PS4, now stop asking",THELEGENDBLUE COZMO23 THEYLL PROBABLY ALLOW US ASCEND GET DAMAGE MAX VALUES,0
2854,damage,,DROP NIGGA DAMAGE,0
2855,damage,Cheshire. London. #allover,UNIONS SAY SUPPORTIVE LONDON YET PREPARED DAMAGE ECONOMICALLY Å£300M LAST TIME,0
2856,damage,"Texas, USA",I LIKED YOUTUBE VIDEO GTA 5 ONLINE COLLATERAL DAMAGE GTA V ONLINE PC,0
2857,damage,"Bartholomew County, Indiana",FYI ACCIDENT PROPERTY DAMAGE3460 LIMESTONE LNCOLYELLOWSTONE WAYFIELDSTONE DR08052015 193635,1
2858,damage,U.S,FITNESS KNEE DAMAGE SOLUTION,0
2860,damage,My mind is my world,AND I COMPLAINING PHOENIX MODE FIRE EMBLEM TURNS RAY GIGANT DIFFICULTY OPTION TAKE 0 DAMAGE,0
2861,damage,,CAPICAPRICAPRI BRENTOBENTO WHA KIDS DAMAGE,0
2863,damage,Catskills,CLEARED ACCIDENT PROPERTY DAMAGE NY35 EB NY 100,1
2864,damage,,ITS CRAZY PHONE MUCH DAMAGE PERSON,0
2865,damage,"Columbia, SC",WRITEBOTHFISTS IT GOT PRETTY WINDY BUT DAMAGE,0
2866,damage,,REUSING ADVANCED LIFE EQUIPMENTS TRANSIT DRUMMING CHAMPAIGN DAMAGE FDBDP,0
2867,damage,Right here,INDIGO6E BUT CARFUL SPOTTING DAMAGE TIME CHECK TIME GIVING AWAY BAGGAGE ITS LOSS WY,0
2869,damage,Texas,STORM DAMAGE REPORTED WEST TENNESSEE,1
2870,damage,"Lawrence, KS via Emporia, KS",HEY ROYALS LOVE DAMAGE 2 OUTS,1
2871,damage,http://twitch.tv/jcmonkey,DROTHVADER CMNEVALISTIS KEEP PLEASE ARACHYS 2 PIECES NOW DEALS 4000 WEAPON DAMAGE 2500,1
2872,damage,Indonesia,MAGES FAIRY TAIL SPECIALIZE PROPERTY DAMAGE NATSU DRAGNEEL,0
2873,damage,Unknown,BRADLEYBRAD47 YEAH FAST EXTREMELY HIGH DAMAGE WANT FAST IM GONNA GET U,1
2875,damage,Unknown,BRADLEYBRAD47 SAW FAST AF GREAT DAMAGE UPGRADED SHITTON USED EXCLUSIVELY WHOLE PLAYTHROUGH,0
2877,damage,"Marysville, MI",LETS SAY TREE FALLS FENCE DO KNOW HOMEOWNERS INSURANCE MAY HELP,0
2878,damage,"New Haven, Connecticut",JOEDAWG42 TOR TOR SITUATION WIND DAMAGE ENHANCED WORDING KEY IMO,1
2879,damage,,HFXSTANFIELD BEELIEVEDC DISCOVERYCNTR HAPPENING HEAR RUNWAY LIGHTING DAMAGE CONTRACTOR,1
2880,damage,Austin | San Diego,SWB1192 NDA WRITTEN DAMAGE ABILITY OFFER SERVICES FUTURE PROLLY DONT WANT WORK ANYWAY,0
2881,damage,??? ?? ??????? ,IF TRILLION CROSSES LINE 3RD TIME FIELDWIDE ATTACK INSTANT KILL DAMAGE,1
2882,damage,"Pontevedra, Galicia",NP METALLICA DAMAGE INC,0
2883,damage,Somewhere in the Canada,NINE INMATES CHARGED CAUSING DAMAGE CALGARY REMAND CENTRE RIOT,1
2884,damage,London/New York,PT CROSSSECTARIAN PROTEST POWERFUL SHIA CLERIC SAYS MILITIAS MUST WITHDRAWUR FIGHTIN ISIS WONT FORGET DAMAGE UVE DONE UR PPL,1
2885,damage,"261 5th Avenue New York, NY ",DOES HOMEOWNERS INSURANCE COVER WATER DAMAGE HERE GOOD THINGS KNOW,1
2886,damage,,BEACH DAMAGE SHIT,1
2887,damage,,WONDEROUSALLURE CROSSES ARMS COVER HANDS ANYMORE DAMAGE HHELLO,0
2888,damage,,NEW POST BLOG THESENSUALEYE MODEL CAM DAMAGE TORONTO APR 2014 NSFW PUSSY ASS BOOBS ASIAN NUDE Û,0
2889,damage,Charlotte NC,REPORTED HIT AMP RUNIN ROADWAYPROPERTY DAMAGE 15901 STATESVILLE RD,1
2890,damage,,DEVIL MAY CRY 4 SPECIAL EDITION VERGIL VS AGNUS WINDOW MISSION 6 DMD NO DAMAGE BY LEEDSTRAIF,0
2891,damage,"Rockville, Maryland",GLAUCOMA OCCURS FLUID BUILDS PRESSURE INSIDE EYE LEVEL MAY DAMAGE OPTIC NERVE EYEFACTS,1
2893,damage,,JSUNNEWS STORM DAMAGE REPORTED MADISON COUNTY THUNDERSTORM DAMAGE REPORTS AR VIA,1
2895,damage,,S61231A PUNCTURE WOUND WITHOUT FOREIGN BODY LEFT INDEX FINGER WITHOUT DAMAGE NAIL INITIAL ENCOUNTER ICD10,1
2896,damage,Australia,THANK RICHARKKIRKARCH AUSINSTARCHITECT WORDS WARNING QUEENSWHARF BRISBANE VIA FINANCIALREVIEW,0
2898,damage,Your Conversation,THIS REAL SHIT DAMAGE BITCH,0
2899,damage,USAoV,LMAO FUCKBOY CHANGED DAMAGE CONTROL PSEUDOJUUZO,0
2900,damage,"Bhopal, Madhya Pradesh, India.",MICHAELWESTBIZ STANDARD DAMAGE CONTROL,1
2902,damage,Tennessee,GETTINGLOST JENNELLENSBB MUNCLEJIM IT SAID SUPERFICIAL WOUNDS PEPPER SPRAY DAMAGE,1
2905,danger,,BLIZZHEROES DUSTINBROWDER DAD I WONT CHASE CONSTANTLY AMP TIME FREQUENTLY WITH GREAT DEAL DANGER DISTRACTION LT3,0
2907,danger,#LemonGang ,I BELIEVE SHIRT COMPANY EVERY ANIMAL EVER DANGER I BETTER START SEEING CHANGES WILDLIFE,0
2908,danger,ayr,DANGER UNION BEARS,0
2909,danger,,THE SIGNUP OPEN FALLING FOR DANGER RELEASE DAY BLAST REVIEW TOUR SIGNUP,1
2910,danger,Worldwide,DYANNBRIDGES YESHAYAD CHECK ROCKIN PREVIEW CLAYTONBRYANT DANGER ZONE COMING SOON ARTISTSUNITED,0
2911,danger,"San Jose, California",RED FLAG WARNING FIRE DANGER AMP DRY THUNDERSTORMS BAY AREA WEATHER CAWX NWSBAYAREA,1
2912,danger,Worldwide,CARSONREX SPACEANGELSEVEN CHECK ROCKIN PREVIEW CLAYTONBRYANT DANGER ZONE COMING SOON ARTISTSUNITED,0
2913,danger,"Loughborough, England",WHAT LIKE I COULD DANGER SOMETHING,1
2915,danger,Killarney,WHEN LAST TREE IS CUT DOWN LAST FISH EATEN LAST STREAM POISONED YOU WILL REALIZE THAT YOU,0
2916,danger,"Brooklyn, NY",MY TAKE AWAY PRESERVATION PARKS R IMPOSITION AMP DANGER AFRICAN PEOPLE I NEVER IMAGINED,0
2917,danger,Lahar & Gwalior,INDIAN GOVT AMP MEDIA TAKE SERIOUS CONCERN SAFETY THEY DANGER,1
2920,danger,"St Paul, MN",TRAINING GRAINS WHEAT BARE GOLD AUGUST HEAT ANGER IM TRESPASS LEST SEEK DANGER,0
2921,danger,Atlanta Georgia ,THEREALRITTZ FETTILOOTCH IS SLANGLUCCI OPPRESSIONS GREATEST DANGER COMING SOON THE ALBUM,0
2922,danger,,MOREHOUSE64 IT APPEARS GOVT LOST ETHICAL MORAL RELEVANCE THIS MEANS WHOLE USA POPULATION DANGER,0
2924,danger,"Lincoln, IL",DONT LIKE HEAD FIRST SLIDES ESPECIALLY HOME DANGER,0
2925,danger,World,PERMITS BEAR HUNTING DANGER OUTNUMBERING ACTUAL BEARS THE LICENSES FLORIDAS FIR ST PETERSBURG,0
2927,danger,Spinning through time.,RIVERROAMING AND MUCH DANGER PLEASE,0
2929,danger,Atlanta Georgia ,BLUEBIRDDENVER FETTILOOTCH IS SLANGLUCCI OPPRESSIONS GREATEST DANGER COMING SOON THE ALBUM,1
2931,danger,"Boston, MA",UBER LOOKING REPAIR RECENT BAD RAP NONPROFIT PARTNERSHIPS,0
2932,danger,Hailing from Dayton ,I WISH I COULD GET VICTORIAS SECRET FRONT IM GOOD,0
2933,danger,Worldwide,TURNEDONFETABOO HSJB215 CHECK ROCKIN PREVIEW CLAYTONBRYANT DANGER ZONE COMING SOON ARTISTSUNITED,0
2934,danger,"Newcastle Upon Tyne, England",THETXI GUNNERSFAN89 WOULD ARSENAL FANS WANT WEST HAM RELEGATION BATTLE SEASON DANGER AFC SUN,0
2935,danger,Atlanta Georgia ,REMAINONTOP FETTILOOTCH IS SLANGLUCCI OPPRESSIONS GREATEST DANGER COMING SOON THE ALBUM,0
2936,danger,Atlanta Georgia ,NUGGETS FETTILOOTCH IS SLANGLUCCI OPPRESSIONS GREATEST DANGER COMING SOON THE ALBUM,0
2937,danger,,THE DANGER EXCITEMENT UNDERWATER CAVE DIVING,0
2939,danger,,THE GIRL I WANNA SAVE LIKE DANGER HEALTH TRY SOMEBODY WANNA SOMEBODY ELSE,0
2941,danger,Instagram: trillrebel_,GUNS PROTECTION THAT SHIT REALLY SHOULDNT USED UNLESS LIFE DANGER,0
2942,danger,ALWAYS DYING NEVER RESTING,SO THIRSTY YALL IN DANGER OF DEHYDRATION,1
2943,danger,"San Jose, CA",THUNDERSTORMS LITTLE RAIN EXPECTED CENTRAL CALIFORNIA HIGH FIRE DANGER WEATHER CAWX,1
2944,danger,2005 |-/,WANNA GET DANGER DAYS TATTOO BAD COOL WOULD SPIDER LOOK LIKE SOMEONES WRIST SMTH,0
2945,danger,Israel,IN EXPERIENCE YOURE ALWAYS ANGRY CRITICAL PUNDIT GRAVE DANGER GOING RAILS 1,0
2946,danger,Uruguay / Westeros / Gallifrey,I DANGER SKYLER I AM THE DANGER,0
2947,danger,"Kansas City, MO",TOO DANGEROUS BUT OK REST US DANGER,0
2948,danger,"Silver Spring, MD",INVESTIGATE ROBERT MUELLER DIDNT RESPOND COMPLAINTS SINCE NOV 2011 AMP LEFT MESON DANGER,0
2950,danger,Jersey - C.I,HONESTLY THO MODIBO MAIGA STEALING LIVING FUCK IM PAST BEST STILL DANGER FUCKTARD COYI,1
2952,danger,,FEAR WAY MAKING US SEE DANGER NONE CONTEMPLATING LOGIC BEHIND SITUATION FIND COURAGE ENGAGE,0
2953,dead,,JOEL 228 AND BOOK ACTS 217,0
2954,dead,Afghanistan,17 DEAD AFGHANISTAN AIRCRAFT CRASHES AN AFGHAN MILITARY HELICOPTER CRASHED REMOTE REGION,1
2955,dead,Sweden,SILENT0SIRIS EVEN AWESOME NORSE LANDSCAPES LOADS ATMOSPHERE LIFE BORINGDEAD SNOTGREEN WASTELANDS,0
2956,dead,,MISS LONGER HAIRBUT DEAD ANYWAYS WASNT EVEN HAIR,0
2957,dead,,CJBANNING 4SAKE ARGSUPPOSE PREBORN ATTAINED INDIVIDL RIGHTSGENERALLY COURTOF LAW FORBIDS KILLING UNLESS DEAD PERSON SOMETHING,0
2959,dead,London,REMEMBER TIME GOKU GAVE LIFE DEAD BIRB HELL GOKU,0
2960,dead,"Orlando, FL",NAAA I BEE DEAD LIKE LEGIT ZOMBIE I FEEL EVERY SORE PART BODY,0
2963,dead,,WE HAPPENED GET ROAD RIGHT BEHIND BUSES IM DEAD SERIOUS,0
2965,dead,Atmosphere,LMFAO FUCKING LUIS HHAHAHA IM DEAD,0
2969,dead,,I WATCHED EMMERDALE ND I DONT KNOW SLIGHTLY ATTRACTIVE MAN NAMED ROSS GOT BEAT ND HES DEAD,1
2970,dead,Glasgow,SOAPSCOOP NEED CONFIRM ROSS DEAD CAUSE DONT TRUST ANYONE ELSE YH,0
2971,dead,,GAILSIMONE IWASDISAPPOINTEDBY TELLTALES THE WALKING DEAD GOOD CHARACTERS AMPSTORY REAL GAMEPLAY MANY PERFORMANCE ISSUES,0
2973,dead,,BEFOREITSNEWS HUNDREDS FEARED DEAD LIBYAN MIGRANT BOAT CAPSIZES RESCUE Û,1
2974,dead,somewhere in Portugal,IF ITÛªS WAR CAME SEE NEVER SEE WAVED WHITE FLAG FRONT I CANÛªT END DEAD I WONT MISLED,0
2975,dead,South Stand,JONES94KYLE OH FUCK SAKE DEAD,0
2976,dead,dundalk ireland,EMMERDALE ROSS REALLY DEAD ASKCHARLEY,0
2980,dead,,DON AVOID WEARING DEAD BLACK FLAMING RED STARK WHITE MUCH ESP DEBATE GO BLUE GOLD BROWN EVEN SHOES,0
2982,dead,,PERSPECTIVES GRATEFUL DEAD CRITICAL WRITINGS CONTRIBUTIONS STUDY,1
2983,dead,"Sochi, KDA, RU",HLPORTAL HELLO IM LOOKING MOD COLD ICE I SAW SITE LINK DOWNLOAD DEAD MAYBE SHARE THANKS,0
2984,dead,"ÌÏT: -26.695807,27.837865",KG4VAAL LMAOVV HARD NY NEW TREND BABALMAOWELCOME NYOZI KWAAAAADEAD,0
2987,dead,South Stand,JONES94KYLE IVE SAID HES DEAD ONE ELSE DIES,0
2988,dead,You're not 19 forever   ,IS ROSS DEAD NOOOOOOOOOOOO MIKEPARRACTOR,0
2990,dead,"Kettering, OH",THINKING TIME FRIEND BAILED NITE B4 DEAD SHOWWENT ALONE AMP GREAT TIME ALL ALONE FREE DANCE FRONT ROW,0
2991,dead,United States,TYPHOON SOUDELOR TAKING DEAD AIM TAIWAN,1
2992,dead,,ASKCHARLEY EMMERDALE HOW EMOTIONAL ROSS DEAD EMMERDALE 5,0
2993,dead,Planet Earth,MAN FOUND DEAD DEMI MOORES SWIMMING POOL,1
2995,dead,Spare 'Oom,THATS VAL DEAD IM SUING,1
2998,dead,,ATCHISONSEAN DEAD,0
3000,dead,United States,WYRMWOOD ROAD DEAD 2014 FUCKING AWESOME AWESOME ENDING AWESOME ONE,0
3001,dead,Milton Keynes ,CANT BELIEVE ROSS DEAD EMMERDALE MIKEPARRACTOR EMMERDALE SUMMERFATE,0
3003,death,,I CALL TEXT 2 NIGGAS BFF AMP BOYFRIEND I LOVE BOYS DEATH NO NIGGAS HOLD ATTENTION LIKE,0
3004,death,ATL??AL??,I HATE TO TALKING OTP WITH MY GRANDMA I MEAN I LOVE HER AS TO DEATH BUT SHE TALK SO DAMN MUCH SSSHHHEEESSHH,0
3005,death,UPTOWN ,UNTIL DEATH ILL FOREVER REP JETS,1
3006,death,,VIBRATOR SHAPED VAPE DONE BUSTED,0
3009,death,PROV,DEATH THREATS NIGGA LIFE WELL GON SEE,0
3010,death,"Novi, MI",ADULT DIES PLAGUE COLORADO,1
3011,death,New York,XBOX 360 PRO CONSOLE RED RING DEATH FULL READ EBAY,0
3012,death,"Buenos Aires, Argentina",GOING BACK GAINESVILLE DEATH,1
3013,death,on the go,A YEAR LATER FERGUSON SEES CHANGE ASKS ITÛªS REAL,0
3014,death,,PAPIICHAMPOO WHAT I ENJOY OBAMA ERA CIVILITY PREZ SAYS GOP SUPPORTS IRANIAN DEATH,0
3015,death,,I FEEL LIKE DEATH,0
3016,death,The UK,I LIKED YOUTUBE VIDEO JEROMEKEM DJ HAZARD DEATH SPORT,0
3018,death,,I TELL COUSINS I DONT WANNA HANG TEXT SAYING COMING HONESTLY DEATH WISH,0
3019,death,,RSS JUDGE ORDERS TEXAS RECOGNIZE SPOUSE SAMESEX DEATH CERTIFICATE,0
3021,death,mpls. ,LOYALTY MISSION INVOLVES KICKING SHITTY NOBLEMAN DEATH I LOVE ELVEN WEIRDO,0
3022,death,"Kensington, MD",THERE WAY SEEMETH RIGHT UNTO MAN END THEREOF WAYS DEATH,1
3023,death,Buffalo/DC,KELLKANE THANKS I NARROWLY AVERTED DEATH FUN YOURE RIGHT,1
3025,death,,ARIANAGRANDE SCREAMQUEENS KATHERINES DEATH,0
3026,death,"Sylacauga, Alabama",ALLAHSFINEST12 DEATH MUSLIMS,1
3027,death,,GOING STARVE DEATH,0
3029,death,,TED CRUZ BASHES OBAMA COMPARISON GOP TO IRANIANS SHOUTING DEATH TO AMERICA,0
3030,death,,ARIANAGRANDE SCREAMQUEENS KATHERINES DEATH,0
3034,death,,NEW CRIME KNOWING RIGHTS PUNISHABLE DEATH,0
3036,death,USA,I ISSUES UPLOADING DEATH TO SMOOCHY AWAKENINGS CLIPS YOUTUBE REASON BICENTENNIAL MAN PAIN ASS,0
3037,death,To The Right of You!,TED CRUZ BASHES OBAMA COMPARISON GOP TO IRANIANS SHOUTING DEATH TO AMERICA TCOT,1
3038,death,Cyprus,CYPRUS NEWS ANALYSIS MULLAH OMARS DEATH MAY SPLIT TALIBANS RANKS OMARS DEMISE WOULD CERTAINLY LEAD,1
3039,death,kansas,I FEEL LIKE DEATHHOLY MOLYS,0
3042,death,"Los Angeles,CA, USA",VIDEO SLAIN MEXICAN JOURNALIST UNKNOWINGLY PREDICTED HIS OWN DEATH VIA BREITBARTNEWS,0
3043,death,"Portland, OR",THERE OLD LADY ROCKIN DEATH METAL SEDAN DOWNTOWN SMOKING CIGARETTE I FOUND REAL MOM,0
3044,death,Carry On Jutta!!!,AFGHAN PEACE TALKS DOUBT MULLAH OMARS DEATH FINANCIAL TIMES MULLAH,0
3045,death,Home of the Takers.,YALL PUSSSSSSSSSY AND SHOOOK TO DEATH OF ME,0
3047,death,"New York, New York",THE FIRST TRIAL DEATH CECILTHELION POSTPONED,0
3048,death,,53 YEARS AGO WEEK ANNIVERSARY MARILYN MONROES DEATH RIPRIPRIP,0
3049,death,?s????ss? a?????,ARIS HINTS SNIPPETS DEATH,0
3051,death,Chicago,TOMORROW DEATH,0
3052,death,"Alicante, Spain",NEW NYC LEGIONNAIRES DISEASE DEATH TOLL RISES FOLLOW,1
3053,deaths,,VAXSHILL 2 DEATHS MEASLES COMPLICATIONS 10 YRS EVERYONE LOOSES SHIT 8 DEAD LEGIONNAIRES MONTH AMP CRICKETS,1
3054,deaths,,BIGAMIST Û÷FIRSTÛª WIFE CHARGED DEATHS Û÷SECONDÛª PREGNANT WIFE CHILD 8 MOTHER NEPHEW 1 UÛ,0
3055,deaths,"Mooresville, NC",DONT GET I77 SOUTH HUGE WRECK AIRLIFT MAYBE DEATHS INTERSTATE COMPLETELY BLOCKED,1
3056,deaths,"Mooseknuckle, Maine",ÛÏLOLGOP 22 CASES VOTER FRAUD YEAR WE NEED NEW LAWS 83 GUN DEATHS DAY WHO ACTUALLY FOLLOWS LAWS AMIRITE VRA50Û,1
3057,deaths,"Palermo, Sicily",SILENCE PALERMO SHIPWRECK CHILDREN DEATHS,1
3058,deaths,,THIS BSF JAWANS DIED FIDAYEEN AKS BLOODY INSAS INSAS RIFLES BLAME SOLDIERS DEATHS MOD,1
3059,deaths,AsunciÌ_n-PY / TÌ_bingen-GER,BREAST MILK ORIGINAL SUPERFOOD RATES WORLDWIDE STALLED 40 CONTRIBUTING 800000 CHILD DEATHS LAST YEAR,0
3060,deaths,"Voorhees, NJ",12 DEATHS REDLIGHT RUNNING CRASHES PEDESTRIANS BICYCLISTS AMP VEHICLE OCCUPANTS HIT REDLIGHT RUNNERS,1
3061,deaths,,RT TRUEDIAGNOSIS 250K DEATHS PER YEAR PHYSICIAN ERROR HOW AVOID ONE,1
3062,deaths,,CDCWHISTLEBLOWER 2 DEATHS MEASLES COMPLICATIONS 10 YRS EVERYONE LOOSES SHIT 8 DEAD LEGIONNAIRES MONTH AMP CRICKETS,1
3064,deaths,,BIGAMIST FIRST WIFE CHARGED DEATHS SECOND PREGNANT WIFE CHILD 8 NEWS,0
3066,deaths,UK,500 DEATHS YEAR FOODBORNE ILLNESS FRACKFREELANCS DEARS DECCGOVUK FRACKFREEEU TARLETONSOPHIE,1
3068,deaths,"Atlanta, GA",HEAR DRFRIEDENCDC TALK AVOID THOUSANDS RESISTANT INFECTIONSDEATHS NEXT 5 YRS ADIOSSUPERBACTERIAS,0
3070,deaths,Planet Earth,IRONY DIED THOUSAND DEATHS,0
3071,deaths,Wakanda,STRICKSKIN NICKSCOMICS LOL USUALLY IM OBJECTIVE MAYBE UNCLE BEN COURSE MOST DEATHS END BUSINESS USUAL,0
3072,deaths,Lagos,COMMENT DEATHS OLDER CHILDREN DATA TELL US NGHLTH,1
3073,deaths,Does it really matter!,DEATHS 7,1
3074,deaths,,EAZZYP NEVER KNOW WOULD HAPPENED GOVT SEEMED THINK BELIEFS WARRANTED DEATHS INNOCENT JAPS,1
3075,deaths,Your screen,REAL MAGIC REAL LIFE WOMEN WENT MISSING OHIO TOWN FOCUS FBI PROBE STRANGE DEATHS,1
3077,deaths,"Phoenix, AZ",NO TWO CASES DONT CONSTITUTE EPIDEMIC PLAGUE HEALTH PUBLICHEALTH,1
3079,deaths,Does it really matter!,DEATHS 3,0
3080,deaths,Edinburgh,HAD LUNCH STEWART AMP JULIAN COUPLE HOURS EARLIER GOOD FINALLY FIND HAPPENED,0
3082,deaths,Weyburn,WEYBURN POLICE WARN PUBLIC FENTANYL DEATHS PROVINCE,1
3083,deaths,UGA '15 Alumnus - Economics ,NONE ANNOYING CRUSTY ALL LIVES MATTER HEAD ASS PEOPLE EVER ACTUALLY SUPPORT CAUSES HATE BLACK DEATHS GET ATTENTION,0
3084,deaths,,ITS TIME TO REDUCE GUN DEATHS,1
3085,deaths,,GREGORYSANDERS USDOT AMP STAT HIGH AUTO DEATHS APPLIES CHILDREN VEHICLE I GUESS RUN LIGHTRAIL BETTER ADULT,0
3086,deaths,Blackpool,CANCERS EQUATE AROUND 25 DEATHS BLACKPOOL KOWING SIGNS COULD SAVE LIFE BECLEARONCANCER,1
3089,deaths,"the void, U.S.A",HIGHQUALITYBIRD REVERSE SITUATION LOL I DONT KNOW 911 US CIVILIAN DEATHS SPECIFICALLY UTILIZED MAKE POLITICAL,1
3090,deaths,london town..,HEARD THERES TWO DEATHS MURDER CHRISSIE KILLS ADAM VAL FINN DIE EMMERDALE,0
3091,deaths,Tennessee/Gallifrey,MATHEWISANGRY Z3KESK1 SALADINAHMED DIED HORRIBLE DEATHS TRAPPED SHIPS KNEW RISK,1
3092,deaths,"Amman, Jordan",FCO MINISTER TOBIASELLWOOD CONDEMNS ATTACK MOSQUE SAUDI ARABIA RESULTED LEAST 15 DEATHS,1
3093,deaths,Blackpool,CANCERS EQUATE AROUND 25 DEATHS BLACKPOOL KOWING SIGNS COULD SAVE LIFE BECLEARONCANCER,1
3095,deaths,"Washington, D.C.",CRITTERS CLIMATE TWO PLAGUE DEATHS COLORADO,1
3097,deaths,,SINCE 1940 YEAR ANGELA SANDERS BORN ROUNDHOUSE KICK RELATED DEATHS INCREASED 13000 PERCENT,1
3099,deaths,"Columbia Heights, MN",WALMART TAKING STEPS KEEP CHILDREN SAFE HOT VEHICLES TAKE LOOK INNOVATIVE CAR SEAT,0
3100,deaths,Top Secret,AS 2010 17 BELUGA DEATHS REPORTED SEAWORLD AVERAGE AGE 15 12 YEARS OPSEAWORLD,1
3101,deaths,"ÌÏT: 10.614817868480726,12.195582811791382",BIGAMIST FIRST WIFE CHARGED DEATHS SECOND PREGNANT WIFE CHILD 8 MOTHE,1
3102,deaths,Top secret bunker ,MAYOROFLONDON PLS REDUCE CYCLIST DEATHS COMPULSORY HIGHWAY CODE TEST EVERY OTHER VEHICLE USES ROAD NOTROCKETSCIENCE,1
3104,debris,"Belbroughton, England",AEROSPACE EXEC PLANE DEBRIS MISSING MH370 PART AIRCRAFT WING FOUND REUNION ISLAND TH,1
3105,debris,,MALAYSIA AIRLINES FLIGHT 370 DISAPPEARED 17MONTHS AGO DEBRIS FOUND SOUTH THE INDIAN OCEAN,1
3106,debris,,MH370 AIRCRAFT DEBRIS FOUND LA REUNION MISSING MALAYSIA AIRLINES,1
3107,debris,772 Temperance Permenence,DISCOVERED PLANE DEBRIS IS FROM MISSING MALAYSIA AIRLINES FLIGHT 370 TIME,1
3108,debris,,CONFIRMED DEBRIS MH370,1
3109,debris,,MH370 AIRCRAFT DEBRIS FOUND LA REUNION MISSING MALAYSIA AIRLINES,1
3111,debris,Nigeria ,MALAYSIA CONFIRMS PLANE DEBRIS WASHED REUNION ISLAND FLIGHT MH370,1
3112,debris,,MH370 AIRCRAFT DEBRIS FOUND LA REUNION MISSING MALAYSIA AIRLINES,1
3114,debris,"46.950109,7.439469",HOW MISSING JETÛªS DEBRIS COULD HAVE FLOATED RÌ©UNION THE NEW YORK TIMES,1
3115,debris,,RÌ©UNION DEBRIS IS ALMOST SURELY FROM FLIGHT 370 OFFICIALS SAY NEW YORK TIMES,1
3116,debris,,RÌ©UNION DEBRIS IS ALMOST SURELY FROM FLIGHT 370 OFFICIALS SAY NEW YORK TIMES,1
3117,debris,In the Shadows,THE DEBRIS FOUND REUNION ISLAND FLIGHT MH370 THE MYSTERY BEHIND PLANE DISAPPEARANCE COULD BETTER NOVEL,1
3118,debris,,MH370 AIRCRAFT DEBRIS FOUND LA REUNION MISSING MALAYSIA AIRLINES,1
3119,debris,Campo Grande-MS,REUTERS DEBRIS CONFIRMED MH370 RELATIVES HOPE DISCOVERY CRASH SITE,1
3120,debris,nbc washington,NBCNIGHTLYNEWS MALAYSIAN OFFICIALS SAY DEBRIS FOUND REUNION ISLAND IS FROM MH370 BILLNEELYNBC REPORTS,1
3122,debris,,MH370 DEBRIS FOUND REUNION ISLAND SAD TRAGEDY INNOCENT CRASH MH370,1
3123,debris,Seattle,LOVE FOOD FUN MALAYSIAN PRIME MINISTER NAJIB RAZAK CONFIRMED AIRCRAFT DEBRIS FOUND RÌ©UNION ISLA,1
3124,debris,"Hamilton, Ontario Canada",MALAYSIA SEEM CERTAIN FRANCE PLANE DEBRIS MISSING MH370,1
3125,debris,New York,MALAYSIAN OFFICIALS SAY DEBRIS FOUND REUNION ISLAND IS FROM MH370 BILLNEELYNBC REPORTS,1
3126,debris,,MH370 AIRCRAFT DEBRIS FOUND LA REUNION MISSING MALAYSIA AIRLINES,1
