id,keyword,location,text,target
5336,fire,,THIS FIRE WAY CLOSE WTF GOING,1
5337,fire,on a catwalk somewhere,FIRE MEET GASOLINE ALWAYS GOTTA GET PLAYED TWICE LOL,0
5338,fire,  å_ ,WCW CATSANDSYRUP THA BITCH IS FIRE,0
5339,fire,Zac Newsome loves me,WELL FEELS LIKE IM FIRE,0
5341,fire,"louisville, kentucky",EYES WORDS ICY BURNS LIKE RUM FIRE,0
5342,fire,,NEWS POLITIFIACT HARRY REIDS 30 PERCENT WOMEN SERVED PLANNED PARENTHOOD CLAIM IS PANTS FIRE LIE,0
5343,fire,,NOTHING LIKE GOOD FIRE,1
5344,fire,Makai,DAUGHTEROFNAI TENSHI ACTIVATED YUKIS FIRE CARD,0
5345,fire,"Fort Valley,GA/Fayetteville,AR",CALIFORNIA SHAKINGCATCHING FIREAND OVERCHARGING PPL RENT PAST 150 YEARS AINT GOING NOWHERE,1
5346,fire,Arizona,THERES FIRE CATALINAS LOOKS KINDA COOL THIS PICTURE DOESNT JUSTICE,1
5347,fire,,ZAYNMALIK DONT OVERWORK YOUR ALBUM GONNA FIRE DONT OVERWORK STRESS I LOVE TAKE CARE,0
5349,fire,"Vancouver, BC",JUSTINLING I PROMISE TAX PANCAKES RAINBOWS DYING FIRE,0
5350,fire,"Newark, NJ",THIS NIGGA CYHI DISS MEEK SUPPOSE THIS SHIT ACTUALLY FIRE,0
5351,fire,the road to success,I WANNA SET SHIT FIRE,1
5352,fire,The Desert,IN WORDS CHARLIE DANIELS FIRE MOUNTAIN RUN BOYS RUNÛ,1
5353,fire,"Sydney, Australia",I CHECKED ÛÒ ON FIRE ZOMATOAUS LOVEFOOD,1
5354,fire,"Yuba City, CA",WHEN HEART BIGGER OBSTACLES FRONT EURO DONTEXPECTNOTHING JULY FIRE EURO,0
5355,fire,,FIRE WAVES DARKNESS,0
5356,fire,University of South Florida,IT MAY SEEM LIKE FIRE LITTLE BURNT,0
5357,fire,,SMELLING BON FIRE DRIVING MAKES WANNA SITTING NEAR ONE MAKING SMORES,1
5359,fire,the moon,WILL DROPPING FIRE SELFIE TOMORROW SAYING YOURE WELCOME AHEAD TIME,0
5362,fire%20truck,"Niagara Falls, Ontario",FIRE CALL BRANT AV DRUMMOND RD FIRE STRUCTURE SINGLE UNITS CAR 6 ON CALL TRUCK,1
5365,fire%20truck,"Woodcreek HS, Roseville, CA",YOUR PSA DAY IF FIRE TRUCK BEHIND LIGHTS GOING MOVE OVER GET CALL,0
5366,fire%20truck,United States,RFP FIRE TRUCK SERVICE BODY F450 FIRE FIGHTING RESCUE AMP SAFETY EQUIPMENT TRANSPORTA,0
5367,fire%20truck,,RENO TRUCK TRAILER CATCHES FIRE RENO,1
5368,fire%20truck,,WILD NIGHT VILLAGE PUGWASH EVERY FIRE TRUCK TOWN LIKE FIRE TRUCK EVERY HOUSE POPULATION6,1
5371,fire%20truck,Here & There,AN 18WHEELER CAME ALONG STRUCK FIRE TRUCK SPINNING AROUND 180 DEGREES CAUSING ROLL,1
5372,fire%20truck,District 12 - Orange County,SIGALERT UPDATE 3N133 CLOSED AT 5 FWY UFN TRASH TRUCK FIRE,1
5373,fire%20truck,Plain O' Texas,BROOKTEKLE DIDNT LOOK LIKE MURDER SCENE 1 COPS FIRE TRUCK 2 FIRE ASSISTANCE CARS ALONG HELICOPTER,1
5375,fire%20truck,SouthEast Asia,FORMER TOWNSHIP FIRE TRUCK USED PHILIPPINES LANGLEY TIMES PHILIPPINES,1
5377,fire%20truck,,FORMER TOWNSHIP FIRE TRUCK USED PHILIPPINES TOWNSHIP LANGLEY ASSISTANT FIRE CHIEF PAT WALKER SPEN,1
5378,fire%20truck,,OUR GARBAGE TRUCK REALLY CAUGHT FIRE LMFAO,0
5379,fire%20truck,,KAPOKEKITO NORTHGATE TACO TRUCK THATS FIRE,1
5380,fire%20truck,,ITS NEVER GOOD SIGN PULL WORK AMP THERES FIVE AMBULANCES AMP FIRE TRUCK BAY WOMPPPP LEAST FRIDAY,1
5381,fire%20truck,"Saipan, CNMI",FIRE TRUCK AMBULANCE K3 PHASE 3 HOPE EVERYONES OKAY PRAYFORSAIPAN,1
5382,fire%20truck,"Orange County, Calif.",SIGALERT NORTH AMP SOUTHBOUND 133 CLOSED BTWN 5 FWY IRVINE BLVD DUE TRUCK FIRE CHP DETOURING TRAFFIC,1
5383,fire%20truck,lost in my thoughts,EEENICE221 TRUE TRUCK CAUGHT FIRE,1
5384,fire%20truck,,JUSTINEJAYYY OHGOD XD I DIDNT MEAN P BUT FIRE TRUCK BACK MAKE GOOD XD,0
5385,fire%20truck,Five down from the Coffeeshop,CAME ACROSS FIRE VIDEO MINEENJOYBABES WAY SAYING HI HES FIRE TRUCK FIREMAN Û,0
5386,fire%20truck,Los Angeles,133 N PAST 5 L LANE REOPENED ALL LANES CLOSED ALL LANES OPEN 133 S TRASH TRUCK FIRE CLEANUP KNX1070,1
5387,fire%20truck,"Orange County, CA",SIGALERT NORTH AMP SOUTHBOUND 133 CLOSED BTWN 5 FWY IRVINE BLVD DUE TRUCK FIRE CHP DETOURING TRAFFIC,1
5389,fire%20truck,Five down from the Coffeeshop,FOUND COOL PHOTO MINE 1952 DODGE WAYNE BODIED 4 WINDOW BUS EX LIBBY MT FIRE DEPARTMENT TRUCK ALL ORIÛ,1
5391,fire%20truck,,TRIDENT 90225 CHEVY FIRE TRUCK W PUMPER IMS FIRE DEPT RED HO 187 PLASTIC,0
5392,fire%20truck,"Tallahassee, FL",TODDLER BEDDING FIRETRUCK BUNDLE FIRE TRUCK FIREFIGHTER STICKER DECALS SIGN WALL,0
5396,fire%20truck,,MONSTER TRUCK RACER CATCHES FIRE FAIR,1
5397,fire%20truck,"Laguna Beach, Calif. ",TRUCK FIRE CLOGS CANYON ROAD,1
5400,fire%20truck," Nevada Carson City,Freeman St",RGJ TRUCK TRAILER CATCHES FIRE RENO,1
5403,fire%20truck,,PHILIPPINES FORMER TOWNSHIP FIRE TRUCK USED PHILIPPINES Û EMERGENCY EQUIPMENT CEBU PHILIPPI,1
5404,fire%20truck,LA ??,THERES FIRE TRUCK PARKING LOT,0
5406,fire%20truck,,EVENING SUN ARTICLE NNO,0
5407,fire%20truck,,CHOOSE HAPPY FIRE TRUCK REST REVIEW KICK PUSH JAYMCLEANAUTHOR,0
5408,fire%20truck,,FORMER TOWNSHIP FIRE TRUCK USED PHILIPPINES LANGLEY TIMES FILIPINO,0
5409,fire%20truck,,JACKSONVILLE FIRE AMP RESCUE ENGINE 58 AWESOME TRUCK OFFICIAL JADE FL VIA YOUTUBE,1
5410,fire%20truck,Aracaju - Sergipe,NJTURNPIKE Å NJTURNPIKE REOPENS HOURS AFTER TRUCK FIRE IN,1
5411,first%20responders,,LUKEBOX SOMETHING FIRST RESPONDERS MILITARY TRUE HEROS BESIDES MUSIC,0
5412,first%20responders,"Nashville, Tennessee",IM GRATEFUL FIRST RESPONDERS MNPDNASHVILLE NASHVILLEFD OTHERS ACTED SWIFTLY SAVE COUNTLESS LIVES TODAY,1
5413,first%20responders,Texas,USATODAY PRAYING FOR GODS HEALING AND SAFETY OF FIRST RESPONDERS,0
5416,first%20responders,Long Eaton åá Derbyshire åá UK,JOIN CHARITY 10K RUN EVENT DONINGTONDASH 11AM START SUN 20 SEPT 2015 CASTLE DONINGTON COMMUNITY FIRST RESPONDERS,0
5417,first%20responders,WorldWide,LOVED WAY BOOK WRITTEN INCLUDE MANY VANTAGE POINTS FIRST RESPONDERS DETKENLANG KINDLE,0
5418,first%20responders,,FIRST RESPONDERS WOULD NEVER SENT WRONG ADDRESS W SMARTTEKS GPSBASED PANIC BUTTON MPERS SAFETY,0
5420,first%20responders,"Portage, IN / Worldwide",Û÷WE CAN HELPÛª SAYS DENVER FIREFIGHTER WORKING TO CURB FIRST RESPONDER SUICIDE,1
5423,first%20responders,"Victoria, BC  Canada",WHATS COOL TEENS BECOMING I LIKE CALL DIGITAL FIRST RESPONDERS FRIENDS NEED LITTLE HELP SUPPORT,0
5425,first%20responders,,CARMIKE CINEMAS ANTIOCH SHOOTING WE ARE GRATEFUL STAFF FIRST RESPONDERS SAFETY IS HIGHEST PRIORITY,1
5426,first%20responders,Roads/Trails Everywhere,RT ROADID THANKS ALEX STORY AMP FIRST RESPONDERS NEED Û,0
5428,first%20responders,New York City,I ADDED SANDY FIRST RESPONDERS LOST THEIR HOMES VIP HOME PAGE GROUP VIMEO,1
5430,first%20responders,"Nashville, TN",THANKFUL FIRST RESPONDERS ESPECIALLY MNPDNASHVILLE LIFE SAVING RESPONSE TODAY ANTIOCH,1
5432,first%20responders,,JUNEAU EMPIRE FIRST RESPONDERS TURN NATIONAL NIGHT OUT,0
5437,first%20responders,"Liberty Township, Ohio",REDS I DONT THROW WORD HERO AROUND LIGHTLY USUALLY RESERVED FIRST RESPONDERS MILITARY BUT HES HERO,0
5439,first%20responders,Aberdeenshire,US WANTS FUTURE FIRST RESPONDERS HIGHTECH,0
5442,first%20responders,"Los Angeles, CA",THERES STILL ROOM PARTY FIRST RESPONDERS AROUND COUNTRY 3RD ANNUAL BEST EVER,0
5443,first%20responders,A Hoop Somewhere,INCASE ACCIDENT FIRST RESPONDERS WOULD KNOW BABY PRESENT,0
5444,first%20responders,Michigan,KIRSTEN GILLIBRAND EXTEND HEALTH CARE TO 911 FIRST RESPONDERS,1
5445,first%20responders,"Bloomington, Indiana",WE CAN HELP SAYS DENVER FIREFIGHTER WORKING TO CURB FIRST RESPONDER SUICIDE,1
5446,first%20responders,USA,FIRST RESPONDERS CONVENE NATIONAL SUMMIT AWARDS GIS TECHNOLOGY GISUSERPR GEOTECH,0
5448,first%20responders,,YORK CO FIRST RESPONDERS COMPETE SAVE LIVES Û÷BADGES BLOODÛª PARAMEDIC EMS,0
5449,first%20responders,"Washington, DC",SOME GOOD INFO HELP FIRST RESPONDERS COPE INDIVIDUAL RESILIENCE FACTSHEET RESPONDERS,0
5450,first%20responders,,IAFFLOCAL4416 LIVES LOST EXCEPT FIRST RESPONDERS PUBLIC THEYRE CHARGED PROTECTING,1
5452,first%20responders,"Basking Ridge, NJ",FIRST RESPONDERS GET INT BRIDGEPORTSPEED FREE SATURDAY DETAILS,0
5454,first%20responders,"Stalybridge, Tameside",AT 999DAY EMERGENCY SERVICES DISPLAY MEETING BRAVE POLICE FIREFIGHTERS FIRST RESPONDERS HELP KEEP US SAFE,1
5455,first%20responders,,THIS WEEK FIRST RESPONDERS DART MEMBERS PARTICIPATING FOUR DAY INTENSIVE TECHNICAL LARGE ANIMAL,1
5458,first%20responders,"Sacramento, CA",AS FIREFIGHTERS MAKE GAINS ROCKYFIRE JERRY BROWN HEADING AREA MEET FIRST RESPONDERS TOMORROW MORNING,1
5459,first%20responders,"Franklin, TN near Nashville",AFTER SHOOTING EVENT THEATER STARBUCKS GIVING FREE COFFEE FIRST RESPONDERS POLICE AMP FIREFIGHTERS ANTIOCHHICKORYHOLLOWTN,1
5460,first%20responders,"St. Louis, Missouri",NO LENDER FEES FOR VETERANS OR FIRST RESPONDERS PAST AND PRESENT LINKEDIN,0
5461,flames,Bandung,NEW GIANT FLAMES GIANT FULL BLACK PANTOFEL INFOORDER SMS087809233445 PIN23928835 PICTWITTERCOMPNPIZODY,1
5462,flames,New York,NEW SNAP ON TOOLS BLACK BASEBALL HATCAP SILVERGRAY EMBROIDERED S LOGO FLAMES FULL REÛ,0
5465,flames,New York,NEW SNAP ON TOOLS BLACK BASEBALL HATCAP SILVERGRAY EMBROIDERED S LOGO FLAMES FULL REÛ,0
5466,flames,"Louisville, KY ",VAMPIRO GOING TABLE FLAMES ULTIMALUCHA LUCHAUNDERGROUND ELREYNETWORK,0
5467,flames,,CABIN FEVER 2 FLAMES,0
5468,flames,"Manhattan, NY",CANT SUMMON FLAMES DIRECTLY HELL STORE BOUGHT FINEME MOMDIES,0
5469,flames,Freeport Ny,JUST ADDED FIRE FLAMES SATURDAY RICK WONDER SPINNING GUEST SET ALONG CHACHI,0
5471,flames,650/559,KELWORLDPEACE TAXSTONE YOGA FLAMES,0
5473,flames,,SBNATION FLAMES WHAT MAKES GOOD PENALTY KILLER,0
5475,flames,dreamy lake,GUESS SAY IGS HOPES WENT FLAMES,0
5476,flames,,ILL CRY PITY PARTYS FLAMES,0
5477,flames,houstn,NEW LIL B X CHANCE NOTHING FLAMES,0
5479,flames,hell,GILDEROY WISH GOOD ENOUGH ADD FLAMES NAILS IM FIRE,1
5480,flames,"Asheville, NC",MY GANG WALKING ROUND WITH THEM BROWN FLAMES AMP THATS 100ND,0
5481,flames,New York,NEW SNAP ON TOOLS BLACK BASEBALL HATCAP SILVERGRAY EMBROIDERED S LOGO FLAMES FULL REÛ,0
5482,flames,St. Patrick's Purgatory,TADHGTGMTEL DUDE SMOKING FUCKING THING WENT FLAMES THOUGH BOMB WENT OMG SCARED,1
5484,flames,,MARYLAND MANSION FIRE KILLED 6 CAUSED DAMAGED PLUG CHRISTMAS TREE REPORT SAYS INTO FLAMES,1
5485,flames,@cockerelshoes,NEW GIANT FLAMES GIANT MANLY BROWN INFOORDER SMS087809233445 PIN2327564D,0
5486,flames,United States,ÛÏYOU SEE DEVASTATION AMP ITÛªS SHOCKINGÛÏ FIREFIGHTERS CONTINUE BATTLE FLAMES CALIFORNIA BENSTRACY REPORTS Û,1
5487,flames,manaus,WATCHING GO FLAMES,1
5488,flames,"Sioux Falls, S.D. ",RP SAID SEE SMOKE COMING SILO 260TH STREET HARTFORD FLAMES,1
5489,flames,,I CHOSE SEARCH JOY TWO US WEÛªLL NEAR SMILES MATTER COLD FLAMES BURN BOD PORTGASSDK,0
5491,flames,Republica Dominicana,MARYLAND MANSION FIRE KILLED 6 CAUSED DAMAGED PLUG CHRISTMAS TREE REPORT SAYS INTO FLAMES FIREFIGHTERS BRAVERY,1
5492,flames,"Eastlake, OH",ERINMARIEFISHY EVERYONE SETTING FLAMES UPON,0
5493,flames,"Hillsville/Lynchburg, VA",FLAMESNATION THATS OPTIMISTIC SIDE NO DOUBT TOUGH BUT DONE I FEEL LIKE GAMES PIVOT DEFENSE,0
5494,flames,U.S.A,MARYLAND MANSION FIRE KILLED 6 CAUSED DAMAGED PLUG CHRISTMAS TREE REPORT SAYS INTO FLAMES,1
5495,flames,Some where,SO PARDON I BURST FLAMES IVE ENOUGH WORLD PEOPLES MINDLESS GAMES,0
5496,flames,Travelling around the world ,AWICKEDASSASSIN WANT BURST FLAMES ANNA HUGGED TIGHTLY,0
5497,flames," 616 Û¢ Kentwood , MI ",SELMOOOOOO EDVINNN IMTARIIK DZAFICHARIS SELMO U CATCHING FLAMES IM GONNA WITNESSING SLAUGHTER,1
5498,flames,,BLOODY ELL LET BURN RUBYBOT,0
5499,flames,,IF OPINION DONT PUT THH INTERNET FURST FLAMES,0
5501,flames,? Jet Life ?,I RISING FOLLOWER GRAPH 2 FOLLOWERS PAST WEEK GET STATS RIGHT,0
5502,flames,Fairy Tail! ,AISUMAGE AKUMAREISU GRAY OPHELIA RED FLAMES BLAZING AROUND PERSON SETTING NEARLY EVERYTHING AREA,1
5503,flames,Santo Domingo Alma Rosa ,SOLOQUIERO MARYLAND MANSION FIRE KILLED 6 CAUSED DAMAGED PLUG CHRISTMAS TREE REPORT SAYS INTO FLAMES FIREFIGHTE,1
5505,flames,Somewhere Around You,MARYLAND MANSION FIRE KILLED 6 CAUSED DAMAGED PLUG CHRISTMAS TREE REPORT SAYS INTO FLAMES,1
5506,flames,Houston |??| Corsicana,CWHOOPS BETTER MAKE SHOTS TOMORROW CAUSE IM RECORDING FLAMES THROWN TOMORROW,0
5507,flames,"Cincinnati, OH",I ADDED VIDEO YOUTUBE PLAYLIST NICKI MINAJ UP IN FLAMES OFFICIAL VIDEO,0
5509,flames,Bacon,HE BETTER SEAN BRO I ADMIT SEAN FLAMES BUT BETTER SEAN,0
5510,flames,,THE ADVANTAGES APROPOS FLAMES FAVORABLE REGARD MISSISSAUGA ONTARIO PWHVGWAX,0
5514,flattened,Some other mansion,FLATTENED CARTOONYLIKE WHOA PAPA,0
5515,flattened,Chicago,ROAD SUCCESS PAVED PENNIES I FLATTENED TRAIN TRACKS YOURE WELCOME,0
5517,flattened,"Astley, Manchester",FEEL LIKE IVE FLATTENED SUMO WRESTLER PAIN GAIN MUAYTAI WANTMYABSBACK STRONG,0
5518,flattened,"Bow, NH",IDEAS IN FOOD FLATTENED,0
5519,flattened,Leicester,ZOUMA FLATTENED CFC,0
5520,flattened,"Frome, Somerset, England",ZOUMA ABSOLUTELY FLATTENED GUY,0
5521,flattened,Mars,FLATTENED,0
5522,flattened,"Melbourne, Victoria",70 YEARS AGO FIRST ATOMIC ATTACK FLATTENED HIROSHIMA 3 DAYS LATER NAGASAKI WAR CRIMES PUT MOSCOW PLACE,1
5524,flattened,UK,TODAY AUGUST 6TH 70TH ANNIVERSARY ABOMB LITTLE BOY DROPPED HIROSHIMA70000 KILLED OUTRIGHT CITY FLATTENED,1
5525,flattened,"Essex, England",WOULD FLATTENED LITTLE MIDGET,0
5526,flattened,"new york, ny",SAID YOSEMITE SAM DRUMPF ÛÏNOBODY Û÷ILL VOTE FLATTENED RABBIT SKIN AHUH HUH Û I ALWAYS SAYÛ,0
5528,flattened,somewhere too cold for me,GRABAKAHITMAN IZIGARCIA FLATTENED MACHIDADID LOSE FIGHTNOPE LOST FIGHTS GUYS SHOULDNT LOST ALSO,1
5529,flattened,Barbados,FLOORED4 FLATTENED EARLY BIRDS GET DE CUPS LAG BOUT PUN DE DOCK WATCH PPL DRINKÛ,0
5531,flattened,,CONKLIN FLATTENED SHUFFLED FEET INSTEAD KICK SLIDE DIDNT GET HANDS CHEST,0
5532,flattened,Leeds,FLATTENED THEE STRIKER,1
5534,flattened,"Wahpeton, ND",PICKING FLATTENED HAY MEN MASONITE WAHPETON ND,0
5535,flattened,,ZOUMA FLATTENED GUY,0
5538,flattened,"Chorley, Lancashire, UK",FYLDE BUILDING SET FLATTENED ONE PRESTONÛªS CITY CENTRE ICONIC BUILDINGS DISAPPEARING SKYLINE,0
5539,flattened,,IAMHORSEFLY HIDE KIDS HIDE WIFE HES LOOSE I THOUGHT I FLATTENED BALL,0
5540,flattened,,WOULDVE GREAT MBIWA FLATTENED LITTLE RAT,0
5541,flattened,"Northampton, MA",JIMMOZEL PUCKFLATTENED BALL LOL,0
5544,flattened,Ventura,I DONT DOUBT BUT IMPLICIT STATEMENT MAKES WANT FLATTENED BUS,0
5545,flattened,Le Memenet,KAINYUSANAGI GRUMMZ PIXELCANUCK FLATTENED RAYNOR RAYNOR BALDING IMPERFECT BIKER MARINE EMO GENERIC WESTERN HERO,0
5547,flattened,"Lubbock, Texas",SEANPECONI JASONFLOYD LYNCHONSPORTS CRISCYBORG I THINK RISK LOSING GETTING NOSE FLATTENED LOT,0
5548,flattened,Derby,MUMS LITERALLY PICKED NEW CAR TODAY FLATTENED BATTERY ALREADY TRYING SORT BLUETOOTH MUPPET,0
5552,flattened,"Mississauga, Ontario",TWEETINGLEW TERSESTUFF NOTLEY FLATTENED HARPER IN HIS HEARTLAND HARPER IMPORTED TENS THOUSANDS TFW SLAVES COST ALBERTANS JOBS,0
5553,flattened,Delhi ,TWILIGHTFAIRY FLATTENED FROG,0
5554,flattened,"Keighley, England",IMAGINE GETTING FLATTENED KURT ZOUMA,0
5555,flattened,Pomfret/Providence,FALLACY STEAM ROLLER ITS OBJECT WHETHER FLATTENED ROBERTCALIFORNIA THEREISONLYSEX,0
5556,flattened,"Baltimore, MD",PHOTO BEACH EARRINGS BEACH JEWELRY VACATION EARRINGS KEEP CALM BEACH ON EARRINGS MADE FLATTENED,0
5557,flattened,,100 1 MIX NEW FLAT DOUBLE SIDED LINERLESS BOTTLE CAPS YOU CHOOSE MIX FLATTENED FULL REÛ,0
5558,flattened,"East Lansing, MI",BIGBURGERBOI55 FLAT FOOTBALLS MORE LIKE FLATTENED SPARTANS CRUSHING BACK DAY HAIL,0
5559,flattened,Rocketing through the galaxy,SATANAOFHELL EVER SEEN FAR A DREAMY LOOK CAME FACE EARS FLATTENED STARTED WALK SLOWLY TOWARD YOUD,1
5560,flattened,New York,100 1 MIX NEW FLAT DOUBLE SIDED LINERLESS BOTTLE CAPS YOU CHOOSE MIX FLATTENED FULL REÛ,0
5561,flood,boston,FIZZY SITTING REGULAR FLOOD SEATS ONE KNOWS,0
5563,flood,United States,JKL CANCELS FLASH FLOOD WARNING BELL HARLAN KNOX KY WX,1
5564,flood,New York,SPOT FLOOD COMBO 53INCH 300W CURVED CREE LED WORK LIGHT BAR 4X4 OFFROAD FOG LAMP FULL REÛ,1
5565,flood,New York,SPOT FLOOD COMBO 53INCH 300W CURVED CREE LED WORK LIGHT BAR 4X4 OFFROAD FOG LAMP FULL REÛ,0
5567,flood,"Warrandyte, Australia",A SMALL FLOOD BIGÅÊCONSEQUENCES,1
5569,flood,"British Columbia, Canada",HOMECOMING QUEEN KILLED WAY HOME PROM FLOOD WATERS SOCIALNEWS,1
5570,flood,,2PCS 18W CREE LED WORK LIGHT OFFROAD LAMP CAR TRUCK BOAT MINING 4WD FLOOD BEAM FULL REAÛ,0
5573,flood,,ITS RAINING SINCE LEFT NOW IM DROWNING FLOOD YOU SEE IVE ALWAYS FIGHTER BUT WITHOUT I GIVE,0
5575,flood,Aix-en-Provence/Utrecht,CREATIONMIN RWRABBIT GOONERATHEIST ATHEISTIC1 LOLATJESUS YET STILL MANY FISH DIE WORLDWIDE FLOOD I WONDER,0
5576,flood,Philadelphia,AND PLEASE DONT FLOOD POOR ROBERTBENGLUNDS MENTIONS HES PUT WORK,1
5577,flood,New York,SPOT FLOOD COMBO 53INCH 300W CURVED CREE LED WORK LIGHT BAR 4X4 OFFROAD FOG LAMP FULL REÛ,0
5578,flood,"Van Buren, MO",ATLARNXX DIDNT,0
5579,flood,New York,12 72W CREE LED WORK LIGHT BAR ALLOY SPOT FLOOD COMBO DIVING OFFROAD 4WD BOAT FULL READÛ,0
5580,flood,New York,2PCS 18W CREE LED WORK LIGHT OFFROAD LAMP CAR TRUCK BOAT MINING 4WD FLOOD BEAM FULL REAÛ,1
5581,flood,"Niagara Falls, Ontario",HELLOTYBEEREN CUE FLOOD PEOPLE IRONICALLY CALLING,0
5582,flood,USA,MOTORS HOT DEALS 452 GTGT 10X 27W 12V 24V LED WORK LIGHT FLOOD LAMP TRACTOR TRUCK SUV UTV AÛ,0
5584,flood,,85V265V 10W LED WARM WHITE LIGHT MOTION SENSOR OUTDOOR FLOOD LIGHT PIR LAMP AUC,0
5586,flood,Hawaii USA,IEMBOTHFO AT 1000 AM 2 NNW HANA MAUI CO HI COUNTY OFFICIAL REPORTS COASTAL FLOOD Û,1
5587,flood,New York,1 PAIR NEW 27W 4 ROUND LED WORK DRIVING FLOOD LIGHT OFFROAD ATV UTV FULL READ EBAY,0
5588,flood,New York,2PCS 18W CREE LED WORK LIGHT OFFROAD LAMP CAR TRUCK BOAT MINING 4WD FLOOD BEAM FULL REAÛ,0
5589,flood,,INTERNET BASICS FLOOD DEFECTIVE INTERTISSUE SOUL MATE MILK TRENCH HOST GUABXFV,1
5590,flood,,BMX ISSUES AREAL FLOOD ADVISORY SHELBY AL TILL AUG 5 900 PM CDT,1
5592,flood,New York,2PCS 18W CREE LED WORK LIGHT OFFROAD LAMP CAR TRUCK BOAT MINING 4WD FLOOD BEAM FULL REAÛ,0
5593,flood,USA,FLOOD ADVISORY EFFECT SHELBY COUNTY AL 9 PM ALWX,1
5594,flood,United States,RT GRANTFACTORY GRANTS FUNDS WEYMOUTH MEETING SEAWALLS FLOOD GRANTS SET THURSDAY NIGHT Û,1
5595,flood,New York,SPOT FLOOD COMBO 53INCH 300W CURVED CREE LED WORK LIGHT BAR 4X4 OFFROAD FOG LAMP FULL REÛ,0
5598,flood,New York,SPOT FLOOD COMBO 53INCH 300W CURVED CREE LED WORK LIGHT BAR 4X4 OFFROAD FOG LAMP FULL REÛ,0
5599,flood,New York,SPOT FLOOD COMBO 53INCH 300W CURVED CREE LED WORK LIGHT BAR 4X4 OFFROAD FOG LAMP FULL REÛ,0
5600,flood,United States,FLOOD ADVISORY ISSUED AUGUST 05 428PM EDT NWS WXKY,1
5602,flood,,SURVIVED PLAGUE FLOATED FLOOD PEEKED HEADS MUD ONES IMMUNE DEAFENING BELLS GOD SURVIVE,0
5603,flood,New York,SPOT FLOOD COMBO 53INCH 300W CURVED CREE LED WORK LIGHT BAR 4X4 OFFROAD FOG LAMP FULL REÛ,0
5604,flood,USA,FLOOD PRONE WATERWAYS IN WESTCHESTER COUNTY NOW ELIGIBLE FOR MILLIONS IN STATE AID NEWYORK,1
5605,flood,Waddesdon,CHINESE RESCUE TEAM ARRIVES MYANMAR HELP FLOOD VICTIMS SITTWAY,1
5608,flood,"Knoxville, TN",FLOOD ADVISORY ISSUED AUGUST 05 710PM CDT AUGUST 05 800PM CDT NWS THE URBAN AND WEATHER,1
5609,flood,New York,12 72W CREE LED WORK LIGHT BAR ALLOY SPOT FLOOD COMBO DIVING OFFROAD 4WD BOAT FULL READÛ,0
5611,flooding,"Rock Springs, WY",ROCK SPRINGS ÛÒ RESIDENTS LIVING ELK STREET CONTINUE BATTLE FLOODING ISSUES MONDAYÛªS RAIN STORM WHILEÛ,1
5612,flooding,Vietnam,CUBAN LEADER EXTENDS SYMPATHY VIETNAM FLOODING,1
5613,flooding,"Tampa-St. Petersburg, FL",BUSINESS SPONGE DOCKS WASHED RAIN FLOODING,1
5614,flooding,,WARLORDQUEEN THRUSTS LITTLE JAMS COCK DEEP INSIDE FLOODING WOMB PUSSY HOT THICK CUM,0
5617,flooding,USA,SEVERE THUNDERSTORMS FLASH FLOODING POSSIBLE MIDSOUTH MIDWEST WEATHER ENVIRONMENT CLIMATE NATURE,1
5618,flooding,"Huntsville, Alabama",1130A RADAR UPDATE WIDESPREAD SHOWERSSTORMS MOVING AREASMINOR FLOODING POSSIBLE HUNWX,1
5619,flooding,"Nova Scotia, Canada",TIPS PREVENT BASEMENT LEAKS CREATE CONTROL JOINTS ELIMINATE RANDOM CRACKING HOMEIMPROVEMENT FLOODING,0
5620,flooding,,FLOODING,1
5621,flooding,Metro Manila,ADORABLEAPPPLE NO REPORTED FLOODING PO AREA TEN4 MMDA,0
5622,flooding,,FLOODING KILLS 166 DISPLACE ONE MILLION PAKISTAN DAILY NEWS AMP ANALYSIS YUGVANI,1
5624,flooding,Breaking News,FLOODING KILLS 166 DISPLACE ONE MILLION PAKISTAN DAILY NEWS AMP ANALYSIS,1
5625,flooding,Jakarta/Kuala Lumpur/S'pore,LAOS FLOODING 10 VILLAGES UNDERWATER WORLD VISION RESPONDING,1
5626,flooding,UK,FLOODS UKFLOODS BRITISH TREKKERS RESCUED AMID FLASH FLOODS HIMALAYAS A GROUP BRITISH TR FLOODING,1
5627,flooding,,SLOPEOFHOPE MAYBE PLAN DILUTE SAFELY SAY WE START CHARGING LONGS WOULD COME FLOODING,0
5628,flooding,Vietnam,CUBAN LEADER EXTENDS SYMPATHY VIETNAM FLOODING,1
5629,flooding,,ILL ONLY DM HOTEL INFO BECAUSE PEOPLE ARE FLOODING MY NOTIFICATIONS ASKING ME FOR INFO,0
5631,flooding,I ACCEPT SONG REQUESTS,WHEN WAVES FLOODING SHORE AND I CANT FIND WAY HOME ANYMORE THATS I LOOK,1
5632,flooding,"Honolulu, Hawaii",IF FLOODING OCCURS HOME HOW STOP MOLD GROWTH VIA PROUDGREENHOME,1
5633,flooding,,FLOODING TRACKS CAUSED DERAILMENT SA INSUBCONTINENT INSUBCONTINENT,1
5634,flooding,"Miami Beach, Fl",THE CHINESE FLOODING NYC MARKET LIKE NEVER,0
5635,flooding,Republic of Texas,OBAMA KEEPS 27 IRAQI CHRISTIAN ASYLUM SEEKERS NDETENTION WHILE FLOODING US WUNSCREENED MUSLIMS VIA DCCLOTHESLINE,1
5638,flooding,"California, USA",SO GRATEFUL SUPPORT FLOODING NETKICORP DINNER GUESTS THANK YOU ALL,1
5641,flooding,Huntsville AL,THERE FLASH FLOODING MADISON VALLEYWX,1
5642,flooding,? ,THEMAINE SOON START FLOODING COMMENT SECTION COME BRAZIL COMMENTS BC,0
5644,flooding,don't run,AND LAST YEAR LOT THE DRUMS ARE FLOODING JANICE IM FALLING,0
5645,flooding,West Midlands,ÛÏBBCENGLAND A BURST WATER MAIN CAUSES MAJOR FLOODING BIRMINGHAM HOSPITAL OMG,1
5646,flooding,Jakarta/Kuala Lumpur/S'pore,HEAVY RAINFALL FLOODING NORTHERN VIETNAM SITUATION REPORT NO2,1
5647,flooding,,CRABBYCALE OH MY GOD THE MEMORIES ARE FLOODING BACK,0
5650,flooding,Global-NoLocation,FLOOD DISASTER BURST WATER PIPE FLOODS APARTMENTS NYCHA SENIOR CENTER NY1 NY1BURST WATER PIPE FLOODS A,1
5651,flooding,,LRT LOOK AT ALL MY TOM FEELS FLOODING BACK,0
5652,flooding,Jakarta/Kuala Lumpur/S'pore,MYANMAR MSF ASSISTING THOUSANDS WORST FLOODING DECADES HITS PARTS MYANMAR,1
5653,flooding,"Ocean City, NJ",RESIDENTS CENTRAL PART OCEAN CITY HEARD ENGINEERS FLOOD MITIGATION OPTIONS TUESDAY OCNJ,1
5654,flooding,,WEN I FINALLY GET GIRL I WANT IM FLOODING YALL WIT PICS US RS THO,0
5655,flooding,belleville,KWISLO I SEE FLOODING MAD DECENT,0
5656,flooding,"Kualar Lumpur, Malaysia",MONSOON FLOODING KILLS DOZENS IN MYANMAR PROMPTING CALLS FOR HELP,1
5657,flooding,"Austin, TX",MEMORIAL UNVEILED TRAVIS COUNTY DEPUTY KILLED SEPT FLOODING TRAVIS COUNTY SHERIFF GREG HAMILTON JOINEDÛ,1
5658,flooding,,FLOODING KILLS 166 DISPLACE ONE MILLION PAKISTAN AT LEAST 166 PEOPLE KILLED NEARLY 11 LAKHÛ,1
5659,flooding,"Nadiad ,Gujarat , India!!",THANKKK U SOO MUCH FLOODING NOTIFICATIONSU FELLA PARSHOLICS R SUPERB AMP JUS SOO AWESOMELOVE LOVE U ALL ALWAYS FRVRGRATEFUL,0
5661,floods,South of D.C.,SLIP SLIDING AWAY FLASH FLOODS INFO WRITERS WTONY NESTER SONORANRATTLER WRITINGTIPS,1
5662,floods,,WHO BRINGING TORNADOES FLOODS WHO BRINGING CLIMATE CHANGE GOD AMERICA HE PLAGUING FARRAKHAN QUOTE,1
5663,floods,Adventist - Lesson Sabbath,MYANMAR FLOODING HEAVY MONSOON RAINS MONTH JULY CAUSED FLOODING FLASH FLOODS LANDSLI,1
5664,floods,Australia,IN INDIA 119000 PEOPLE TAKEN SHELTER 966 RELIEF CAMPS GOVERNMENT SET FLOODS,1
5665,floods,,PMHARPER DONT WORRY IM SURE CLIMATE NOTHING HAIL FLOODS TORNADOS ALBERTA AMP ONTARIO IM SURE GODS MAD,1
5668,floods,Passamaquoddy,ICTYOSAUR I NEVER THOUGHT WOULD WTF MOMENT YET MONTHS 90 DEGREE HEAT NEXT FLASH FLOODS,1
5669,floods,Û¢III.XII.MMXIÛ¢,GRANTED LIKE HALF TOWN FLOODS RAINS STILL WHATEVER,1
5670,floods,"Sherwood, Brisbane, Australia",MADONNAMKING RSPCA SITE MULTIPLE 7 STORY HIGH RISE BUILDINGS NEXT LOW DENSITY CHARACTER RESIDENTIAL AREA FLOODS,0
5671,floods,canada,CYBERDEMON531 HOPE MOUNTAIN DEW ERODES THROAT FLOODS LUNGS LEAVING DROWN DEATH,1
5672,floods,Michigan,DISASTER GROUP STUNNED FLOODS,1
5673,floods,london,THERES PERSON AMP RECKON YOURE DYING BRAIN FLOODS DMT CAUSING RELIVE LIFE REAL TIME SIMULATION,0
5674,floods,,HAVE EVER REMEMBERED OLD SONG SOMETHING HAVENT HEARED YEARS WORDS CARRY FLOODS MEMORIES ALONG PRICELESS,0
5675,floods,California,FLOODS FISHING FINALLY SUNSHINE AMP FAB DEALS ALBERTSONS ANNIVERSARY SALE LAUREN PAINTS BEAUTIFUL LIFE,0
5676,floods,Global-NoLocation,FLOOD DISASTER BENGAL FLOODS CM MAMATA BANERJEE BLAMES DVC BJP CLAIMS STATE FAILED USE ECONOMIC T,1
5677,floods,,69 DEAD DUE FLOODS MYANMAR NAYPYIDAW AUG 5 PRENSA LATINA THE DEATH TOLL ROSE TODAY 69 MYANMAR,1
5680,floods,Estados Unidos,TYPHOON SOUDELOR APPROACHES 7 KILLED 2 MISSING FLOODS PHILIPPINES VIA ABC7CHICAGO,1
5683,floods,New Jersey,CASEWRITES RAINS NJ FLASH FLOODS OTHERWISE DESERT GRIEF TAXES,1
5684,floods,"New York, NY",DOWNLOAD ITUNES FLOODS OF GLORY LUIZ SANTOS JAZZ ART MUSIC,0
5685,floods,"Timaru District, New Zealand",CONTACTENERGY YEP DURING FLOODS 1999 2000 CLYDE DAM RELEASING EVERY BIT WATER COULD MOST SPECCY EV CHARGING WAY,1
5686,floods,Cameroon,BAMENDA FLOODS KILL ANIMALS BIRDS,1
5687,floods,"St Austell, Cornwall",I HOPE RAINS THROUGHOUT WHOLE WEEKEND I HOPE FLOODS PORTALOOS BECOME SENTIENT,0
5688,floods,"Ogba, Lagos, Nigeria",APC CHIEFTAIN TASKS DICKSON ON N15B FLOODS DONATION TO BAYELSA,1
5689,floods,Philippines,PAGASA 712AM YELLOW WARNING PANAY ISLAND GUIMARAS NEGROS POSSIBLE FLOODS LOWLYING AREAS AMP LANDSLIDES MOUNTAINOUS AREAS,1
5690,floods,,RT 40HOURFAMINE IN BANGLADESH GOVERNMENT DECLARED FLOODS EMERGENCY WORLDVISION CONTINUE MÛ,1
5692,floods,North America,NEARLY 50 THOUSAND PEOPLE AFFECTED FLOODS PARAGUAY,1
5693,floods,Earth,ETP BENGAL FLOODS CM MAMATA BANERJEE BLAMES DVC BJP CLAIMS STATE FAILED USE RELIEF FUNDS EVEN FLOOD W,1
5694,floods,,MAY ALLAH HELP SUFFERING PAKISTAN FLOODS YOU FAMILIES DUA,1
5695,floods,,CHILDREN MYANMAR FACE DOUBLE CATASTROPHE FLOODS HIT,1
