id,keyword,location,text,target
7962,razed,Nigeria,TENSION IN ABIA AS INEC OFFICEÛªS RAZEDÅÊÛÒ GOVERNOR IKPEAZU PDP APGA REACT,1
7963,razed,"Tulsa, OK",THE LATEST MORE HOMES RAZED NORTHERN CALIFORNIA WILDFIRE THE LATEST WILDFIRES BURNING CALIFORNIA ANDÛ,1
7965,razed,,THE LATEST MORE HOMES RAZED NORTHERN CALIFORNIA WILDFIRE,1
7968,razed,,THE LATEST MORE HOMES RAZED NORTHERN CALIFORNIA WILDFIRE ABC NEWS,1
7969,razed,,THE LATEST MORE HOMES RAZED NORTHERN CALIFORNIA WILDFIRE ABC NEWS,1
7970,razed,,THE LATEST MORE HOMES RAZED NORTHERN CALIFORNIA WILDFIRE LYNCHBURG NEWS ADVANCE,1
7971,razed,WorldWide,NEWS THE LATEST MORE HOMES RAZED NORTHERN CALIFORNIA WILDFIRE NEW YORK TIMES TAFS FB100,1
7972,razed,,THE LATEST MORE HOMES RAZED NORTHERN CALIFORNIA WILDFIRE ABC NEWS,1
7973,razed,,THE LATEST MORE HOMES RAZED NORTHERN CALIFORNIA WILDFIRE ABC NEWS,1
7976,razed,,THE LATEST MORE HOMES RAZED NORTHERN CALIFORNIA WILDFIRE,1
7977,razed,,THE LATEST MORE HOMES RAZED NORTHERN CALIFORNIA WILDFIRE,1
7978,razed,,THE LATEST MORE HOMES RAZED NORTHERN CALIFORNIA WILDFIRE,1
7980,razed,North,PETEREALLEN HUFFPOSTUK BBC5LIVE HOW SIGNIFICANT THINK ICONIC PIC CHURCH MAYBE RUINS LESS SUBSTANTIAL EFFORTS RAZED,0
7981,razed,,THE LATEST MORE HOMES RAZED NORTHERN CALIFORNIA WILDFIRE,1
7982,razed,,THE LATEST MORE HOMES RAZED NORTHERN CALIFORNIA WILDFIRE,1
7983,razed,,THE LATEST MORE HOMES RAZED NORTHERN CALIFORNIA WILDFIRE ABC NEWS,1
7984,razed,"Ames, IA",DAVIDVONDERHAAR AT LEAST SINCERE,1
7987,razed,,THE LATEST MORE HOMES RAZED NORTHERN CALIFORNIA WILDFIRE ABC NEWS,1
7988,razed,,THE LATEST MORE HOMES RAZED NORTHERN CALIFORNIA WILDFIRE ABC NEWS,1
7989,razed,,THE LATEST MORE HOMES RAZED NORTHERN CALIFORNIA WILDFIRE,1
7990,razed,San Diego California 92101,MORE HOMES RAZED NORTHERN CALIF WILDFIRE SANDIEGO,1
7991,razed,Nairobi-KENYA,GEORGE NJENGA HERO SAVED BURNING FRIEND RAZING WILDFIRE,1
7992,razed,"Erie, PA",TODAY ANOTHER DUALCOM IMRAZED ENJOYED YESTERDAYS CHECK TODAYS 5 PM EASTER,0
7994,razed,,THE LATEST MORE HOMES RAZED NORTHERN CALIFORNIA WILDFIRE ABC NEWS GN,1
7996,razed,,THE LATEST MORE HOMES RAZED NORTHERN CALIFORNIA WILDFIRE ABC NEWS,1
7999,razed,,THE LATEST MORE HOMES RAZED NORTHERN CALIFORNIA WILDFIRE ABC NEWS,1
8000,razed,,THE LATEST MORE HOMES RAZED NORTHERN CALIFORNIA WILDFIRE ABC NEWS,1
8001,razed,,THE LATEST MORE HOMES RAZED NORTHERNCALIFORNIA WILDFIRE ZIPPEDNEWS,1
8002,razed,,THE LATEST MORE HOMES RAZED NORTHERN CALIFORNIA WILDFIRE,1
8003,razed,Nairobi-KENYA,GEORGE NJENGA HERO SAVED BURNING FRIEND RAZING WILDFIRE,1
8005,razed,,THE LATEST MORE HOMES RAZED NORTHERN CALIFORNIA WILDFIRE,1
8006,razed,,THE LATEST MORE HOMES RAZED NORTHERN CALIFORNIA WILDFIRE ABC NEWS,1
8008,razed,"Augusta, Maine, 04330",VASSALBORO HOUSE RAZED MAKE WAY PUBLIC GAZEBO PETELMCGUIRE REPORTS,0
8009,refugees,,THIS JUSTMARRIED TURKISH COUPLE GAVE 4000 SYRIAN REFUGEES INCREDIBLE GIFT FED INSTEAD FAMILY AMP FRIENDS,1
8010,refugees,Ad Majorem Dei Glorium,POLICE MONITORING 200 JIHADIS POLAND VIA FREEDOMOUTPOST,1
8012,refugees,"Aurora, Ontario ",TURKISH NEWLYWEDS DONATE WEDDING MONEY BEAUTIFUL GESTURE STILL FAITH HUMANITY,0
8013,refugees, Baku & Erzurum ,THIS JUSTMARRIED TURKISH COUPLE GAVE 4000 SYRIAN REFUGEES INCREDIBLE GIFT WASHINGTONPOST,1
8015,refugees,Statute Of Limitations_,REPULSIVE REFUGEESVICTIMISERDUTTON EVANGELICALLIARABBOTT CO LNP DUPE PRESS OVERDRIVE CHOPPERGATEBRONWYNBISHOPAUSPOL,0
8016,refugees,paradise,RETWEET CAMEROON REPATRIATING 12000 NIGERIAN REFUGEES DUE BOKO HARAM,1
8017,refugees," BC, US, Asia or Europe.",NEWLYWEDS FEED SYRIAN REFUGEES WEDDING CBC NEWS LATEST CANADA WORLD ENTERTAINMENT BUSINESS NEWS,0
8018,refugees,,WOWO 12000 NIGERIAN REFUGEES REPATRIATED CAMEROON,1
8019,refugees,,HMM 12000 NIGERIAN REFUGEES REPATRIATED CAMEROON,1
8020,refugees,,WHAO 12000 NIGERIAN REFUGEES REPATRIATED CAMEROON,1
8021,refugees,St PetersburgFL,IMAGINE ENTIRE AISLE DEDICATED MAKING PEOPLE LOOK LIKE SERBIAN REFUGEES DIRECTOR WHOLE FOODS CLOTHING SECTION,0
8023,refugees,EspaÌ±a,VIRALSPELL COUPLE SPEND WEDDING DAY FEEDING 4000 SYRIAN REFUGEES SEE,0
8024,refugees,,REAAD PLSSS 12000 NIGERIAN REFUGEES REPATRIATED CAMEROON,1
8025,refugees,Tarragona,TOP STORY VIRALSPELL COUPLE SPEND WEDDING DAY FEEDING 4000 SYRIAN REFUGEESÛ SEE,0
8026,refugees,,REFUGEE CONNECTIONS INDIEGOGO CAMPAIGN GOING LIVE TOMORROW SUPPORT US HELP LAUNCH ONLINE COMMUNITY REFUGEES,1
8028,refugees,,YALL READ 12000 NIGERIAN REFUGEES REPATRIATED CAMEROON,1
8029,refugees,,SHORT THROWING OVERBOARD I DONT THINK LEADER COULD MUCH WORSE REFUGEES TONYABBOTTMHR WORST PM EVER,1
8030,refugees,Warri,CAMEROON REPATRIATED 12000 NIGERIAN REFUGEES,1
8031,refugees,Melbourne Australia,CAPTAIN ABBOTT MUST GO LNP BOAT REFUGEES CHRISTIANVALUES,0
8032,refugees,,A TURKISH COUPLE SPENT WEDDING DAY FEEDING 4000 SYRIAN REFUGEES A TURKISH COUPLE GOT MARRIE Û,0
8034,refugees,"21.462446,-158.022017",HOW ONE COUPLE IS USING DRONES SAVE REFUGEES WORLDS DEADLIEST BORDER,1
8035,refugees,,WHAO 12000 NIGERIAN REFUGEES REPATRIATED CAMEROON,1
8036,refugees,,HMM 12000 NIGERIAN REFUGEES REPATRIATED CAMEROON,1
8037,refugees,"Bangalore, India",TURKISH COUPLE DECIDED FEED 4000 SYRIAN REFUGEES PART WEDDING CELEBRATIONS,0
8038,refugees,Skyhold,FADELURKER DALINTHANELAN LT RIGHT EVEN TWO YEARS STILL REFUGEES CAMPED SOUTH REDCLIFFE VILLAGE AIDAN GT,1
8039,refugees,Australia,NEWLYWEDS FEED THOUSANDS SYRIAN REFUGEES INSTEAD HOSTING BANQUET WEDDING DINNER AGE NEWS,0
8040,refugees,"Amman,Jordan",IN PHOTOS THE YOUNG REFUGEES FORCED FLEE BURUNDIS VIOLENCE VICE NEWS SEE,1
8043,refugees,tripoli international airport,KRISTINDAVIS UN REFUGEES THANK UN REFUGEES HELPING MANY PEOPLE NEED WORLD Û,0
8044,refugees,,WOWO 12000 NIGERIAN REFUGEES REPATRIATED CAMEROON,0
8045,refugees,,NEWLYWEDS FEED THOUSANDS SYRIAN REFUGEES INSTEAD HOSTING BANQUET WEDDING DINNER VIA SMH,1
8047,refugees,"Auckland, New Zealand",PACIC MEDIA CENTRE ARTICLES AUSTRALIA RSF PROTESTS NEW SECURITY GAG REPORTING,0
8049,refugees,,RECAP 12000 NIGERIAN REFUGEES REPATRIATED CAMEROON,1
8055,refugees,"NYC,US - Cali, Colombia",THE MOST GENEROUS BRIDE EARTH COUPLE FEEDS 4000 SYRIAN REFUGEES THEIR WEDDING DAY VIA THEDAILYBEAST LOVE,0
8056,refugees,,WHAO 12000 NIGERIAN REFUGEES REPATRIATED CAMEROON,1
8057,refugees,QLD Australia,THE 46 RETURNED REFUGEES FLEEING AMP VIETNAMESE GOVT TREAT RETURNED DUTTON PRESSER,1
8058,refugees,"Geneva, Switzerland",CHPSRE RT REFUGEES FOR FOLLOWERS PARIS VISIT A DREAM HUMANITY EXHIBITION REZAPHOTOGRAPHY Û Û,1
8060,rescue,Trinidad & Tobago,POLICYHOLDERS OBJECT CLICO RESCUE PLAN,1
8061,rescue,SF Bay Area,DONT PANIK KELBYTOMLINSON RESCUE,0
8062,rescue,#HarleyChick#PJNT#RunBenRun,COASTAL GERMAN SHEPHERD RESCUE OC SHARED LINK ANIMALRESCUE,0
8064,rescue,"Toronto, Ontario",UD RESCUE STRUCTURAL COLLAPSE SCOTT ROAD YPRES ROAD YORK 14 TRUCKS,1
8065,rescue,New Jersey,RESCUE DAY ITÛªS WORLD CAT DAY SATURDAY AUG 8TH BLACK BLACKWHITE CATS 5 NEWBEGINNINGSANIMALRESCUE,0
8066,rescue,Big NorthEast Litter Box,IM 2 BLOOD PRESSURE MEDS STILL PROBABLY ROOF LONG PPACT STORY BROKE I INVOLVED ANIMAL RESCUE,0
8067,rescue,Sand springs oklahoma,COASTAL GERMAN SHEPHERD RESCUE OC SHARED LINK ANIMALRESCUE,0
8068,rescue,,COASTAL GERMAN SHEPHERD RESCUE OC SHARED LINK ECSTATIC RESCUED RACCO ANIMALRESCUE,0
8069,rescue,,SUGGS AMP VIVIAN RESCUE PSYCHREWATCH,0
8070,rescue,"Surry Hills, Sydney",ANY LENGTHS RESCUE CAT NEED,0
8071,rescue,Sand springs oklahoma,LAST CHANCE ANIMAL RESCUE 3 NEW POSTS ANIMALRESCUE,0
8073,rescue,#HarleyChick#PJNT#RunBenRun,LAST CHANCE ANIMAL RESCUE 3 NEW POSTS ANIMALRESCUE,0
8074,rescue,,SAMMY TODD ALWAYS RESCUE MAY UNIFORM STILL RESCUE LMAO FOREVER KFC FAM,0
8079,rescue,USA,LUNCH CREW MADE NIGHT NIGHT LONG DAY PEACELOVERESCUE,0
8081,rescue,Thornton  Colorado,TELL UNITED NATIONS PLANTATIONS NOT FORESTS VIA RAINFORESTRESQ,0
8083,rescue,Wanderlust,MARY COMING TROY RESCUE,0
8084,rescue,"Toronto, Ontario",UD RESCUE STRUCTURAL COLLAPSE SCOTT ROAD YPRES ROAD YORK 14 TRUCKS,1
8085,rescue,Karachi,FLOODZONE GENERAL RAHEEL SHARIF VISITS CHITRAL HE ALSO LAUDED EFFORTS FWO ARMY TROOPS ARMY AVIATION RESCUE OPERA,1
8087,rescue,,LAST CHANCE ANIMAL RESCUE 3 NEW POSTS ANIMALRESCUE,0
8088,rescue,,LISAVANDERPUMP HOW MANY DOGS RESCUE DOGS,0
8089,rescue,India,OFFICIALS RESCUE 367 MIGRANTS LIBYA 25 BODIES FOUND FOX NEWS NEWS,1
8091,rescue,U.S.A.   FEMA Region 5,COASTAL GERMAN SHEPHERD RESCUE OC SHARED LINK ANIMALRESCUE,0
8094,rescued,United States,ZAKBAGANS SABRINA DAD RESCUED DUDE KEPT CAGE WEVE SINCE I 4,1
8095,rescued,,BRITONS RESCUED AMID HIMALAYA FLOODS,1
8096,rescued,Nigeria,4 KIDNAPPED LADIES RESCUED POLICE ENUGU NIGERIAN TRIBUNE,1
8097,rescued,Jakarta,RESCUED MED MIGRANTS ARRIVE SICILY,1
8098,rescued,"Ohio, USA",TENNOATAX I HAND GLASS WATER SIT I RESCUED TENNO IVE LIVED SHIP AROUND DOJO YEAR,0
8100,rescued,watford,TRUST US GET RESCUED DOPEY ONES VAL HILARIOUS SHAME SHES PROBABLY GOING DIE EMMERDALE,0
8101,rescued,West Hollywood,SUMMER SUMMERVIBES CALIFORNIA PUPPY PITMIX RESCUED BRIXTON BANKSY HAPPY MYBABIES,0
8102,rescued,Kent,MAN WHO BURIED DOG ALIVE THOUGHT NO ONE WOULD FIND HER BUT SHE WAS RESCUED JUST IN TIME,0
8103,rescued,Canada,10MONTHOLD BABY GIRL RESCUED COASTGUARD SHE FLOATED HALF A MILE OUT SEA SOCIALNEWS,1
8105,rescued,The Multiverse,BUT SKYRIM AWAITS RESCUEDAGAIN,0
8106,rescued,USA,RESCUED MED MIGRANTS ARRIVE SICILY,1
8109,rescued,Bournemouth,THE FINNISH HIP HOP PIONEER PALEFACE RESCUED DRIFTING RAFT BROUGHT CONTAINER LATER ENKELBILJETT MENOLIPPU,0
8110,rescued,Jammu | Kashmir | Delhi,18 BOVINES RESCUED 3 SMUGGLERSÅÊNABBED,1
8111,rescued,,FUNDS NEEDED RESCUED ABANDONED COCKER SPANIELS,0
8112,rescued,,I LIKED YOUTUBE VIDEO ROMANATWOODVLOGS RESCUED SICK KITTENS,0
8113,rescued,,NEWS BRITONS RESCUED AMID HIMALAYA FLOODS,1
8116,rescued,southern california,A BRAVE LITTLE DOG GETS RESCUED RIVER HIS RECOVERY INSPI VIA YOUTUBE,0
8118,rescued,"Philadelphia, Pennsylvania USA",HOMELESS MAN TRAVELING ACROSS USA WITH 11 STRAY DOGS HE RESCUED GETS A HELPING HAND FROM STRANGERS VIA RESHAREWORTHY,0
8119,rescued,,BRITTANYPETKO BREAKING NEWS TONIGHT KIDS RESCUED PLAY ROOM WEEK FOOD WATER PARENTS SEX LIFE HAHA,1
8120,rescued,"Winston-Salem, NC",YOU RESCUED ACTUALLY PRETEND GIORGIO HIATT,0
8121,rescued,"Huntley, IL",WE RESCUED DOG LEAST 9 YEARS AGO SHES OLD STILL SWEET EVER ZAKBAGANS,0
8122,rescued,NIGERIA,RESCUED MED MIGRANTS ARRIVE SICILY HUNDREDS MIGRANTS RESCUEDÛ,1
8125,rescued,The green and pleasant land.,WHY WERENT TAKEN BACK AFRICA RESCUED C4NEWS,1
8126,rescued,Earth,MIGRANTS RESCUED AFTER BOAT CAPSIZES OFF LIBYA,1
8128,rescued,,YOUNG CHILDREN AMONG RESCUED CAPSIZED BOAT LIBYA VIA IRISHTIMESWORLD,1
8129,rescued,,HEROES A SPRINGER SPANIEL AMP DOG DAD RESCUED STRANDED BABY DOLPHIN,1
8130,rescued,"Leeds, U.K.",TRUST US GET RESCUED DOPEY ONES EMMERDALE SUMMERFATE,0
8131,rescued,Ireland,THREE BEACHED WHALES RESCUED KERRY,1
8133,rescued,,RESCUED TB GOES RIBBON HITS VIA OFFTRACKHORSE,0
8135,rescued,,TURN BACK I RESCUED SWEPT AWAY SINS THOUGH CLOUDS ISAIAH 4422 CONTEMPORARY ENGLISH VERSION,0
8136,rescued,"Pennsylvania, USA",ZAKBAGANS PETS R LIKE PART FAMILY I LOVE ANIMALS THE LAST 2 PETS I I RESCUED BREAKS HEART ANIMALS MISTREATED,0
8137,rescued,Boston MA,I LIKED YOUTUBE VIDEO HOMELESS DOG LIVING CARDBOARD BOX GETS RESCUED AMP HEARTWARMING,0
8138,rescued,Canada,ANGRY MISTRUSTFUL RESCUED ELEPHANT FINDS PEACE FRIENDSHIP HER NEW HOME PHOTOS VIA ONEGREENPLANET,0
8140,rescued,Jakarta/Kuala Lumpur/S'pore,PHOTO HUNDREDS RESCUED MIGRANTS AWAIT DISEMBARKMENT IRISH NAVAL VESSEL PALERMO ITALY TCONNELLYRÛ,1
8141,rescued,Cape Town,RESCUED MED MIGRANTS ARRIVE SICILY,1
8142,rescuers,Nigeria,VIDEO WERE PICKING BODIES WATER RESCUERS SEARCHING HUNDREDS MIGRANTS AFRICA NEWS,1
8143,rescuers,Westerland,VIDEO WERE PICKING BODIES WATER RESCUERS SEARCHING HUNDREDS MIGRANTS MEDITERRAN,1
8144,rescuers,Kuala Lumpur,VIDEO WERE PICKING BODIES WATER RESCUERS SEARCHING HUNDREDS MIGRANTS MEDITERRAN,1
8146,rescuers,Surabaya,VIDEO WERE PICKING BODIES WATER RESCUERS SEARCHING HUNDREDS MIGRANTS MEDITERRAN,1
8147,rescuers,#iminchina,VIDEO WERE PICKING BODIES WATER RESCUERS SEARCHING HUNDREDS MIGRANTS MEDITERRANEAN,1
8149,rescuers,,WORLD FEARS MISSING MIGRANTS MED RESCUERS SEARCH SURVIVORS BOAT CARRYING MANY NEWS,1
8150,rescuers,Africa,DURBANKNIGHT RESCUERS SEARCHING HUNDREDS MIGRANTS MEDITERRANEAN BOAT CARR NOSYBE,1
8154,rescuers,,I UNEXPLAINABLE DESIRE WATCH THE RESCUERS CHILDHOODDEFINED,0
8155,rescuers,Nigeria,RODDYPIPERAUTOS FEARS MISSING MIGRANTS MED RESCUERS SEARCH SURVIVORS BOAT CARRYING,1
8156,rescuers,Birmingham,ANDYGILDER CHANNEL 5 RSPCA DOG RESCUERSTHE INFOMERCIAL CREPT BACK DOOR,0
8158,rescuers,,VIDEO WERE PICKING BODIES WATER RESCUERS SEARCHING HUNDREDS MIGRANTS MEDITERRANEAN BOAT CARRYI,1
8159,rescuers,,WOMANÛªS GPS APP GUIDES RESCUERS INJURED BIKER MARIN COUNTY,1
8161,rescuers,,VIDEO WERE PICKING BODIES WATER RESCUERS SEARCHING HUNDREDS MIGRANTS MEDITERRAN,1
8162,rescuers,London,VIDEO WERE PICKING BODIES WATER RESCUERS SEARCHING HUNDREDS MIGRANTS MEDITERRAN,1
8163,rescuers,,VIDEO WERE PICKING BODIES WATER RESCUERS SEARCHING HUNDREDS MIGRANTS MEDITERRANEAN BOAT CARRYI,1
8164,rescuers,,VIDEO WERE PICKING BODIES WATER RESCUERS SEARCHING HUNDREDS MIGRANTS AFRICA NEWS,1
8165,rescuers,,LAST SECOND EBAY BID RT SHAOLIN RESCUERS DVD 2010 SHEN CHAN NAN CHIANG FIVE VENOMS KUNG FU PLEASE FAVORI,0
8168,rescuers,,VIDEO WERE PICKING BODIES WATER RESCUERS SEARCHING HUNDREDS MIGRANTS MEDITERRANEAN BOAT CARRYI,1
8169,rescuers,,WORLDNEWS VIDEO WERE PICKING BODIES WATER BBC NEWS HOME RESCUERS SEARCHING HUNDREDS,1
8170,rescuers,"?????????????, Thailand ",VIDEO WERE PICKING BODIES WATER RESCUERS SEARCHING HUNDREDS MIGRANTS MEDITERRAN,1
8171,rescuers,,VIDEO WERE PICKING BODIES WATER RESCUERS SEARCHING HUNDREDSÛ,1
8172,rescuers,17th Dimension,AHMAZING STORY POWER ANIMAL RESCUERS A STARVING HOMELESS DOG FUTURE RESCUED PERSON,1
8175,rescuers,,RESCUERS SEARCHING HUNDREDS MIGRANTS MEDITERRANEAN BOAT CARRYING MANY 600 PEOPLE CAPSIZED COAST OFÛ,1
8176,rescuers,Washington,NEWS MANY DEATHS SHIPWRECK RESCUERS TRYING SAVE HUNDREDS MIGRANTS VIA THENEWSHYPE,1
8177,rescuers,USA - Canada - Europe - Asia,VIDEO WERE PICKING BODIES WATER RESCUERS SEARCHING HUNDREDS MIGRANTS MEDITERRAN,1
8180,rescuers,worldwide,VIDEO WERE PICKING BODIES WATER RESCUERS SEARCHING HUNDREDS MIGRANTS MEDITERRAN,1
8181,rescuers,Phoenix,WHEN RESCUERS FOUND HIM HE WAS BARELY ALIVE BUT THEY HAD NO IDEA HE WAS ALLERGIC TO THIS,1
8182,rescuers,,FEARS MISSING MIGRANTS MED RESCUERS SEARCH SURVIVORS BOAT CARRYING MANY 600 MIGRANT,1
8183,rescuers,,VIDEO WERE PICKING BODIES WATER RESCUERS SEARCHING HUNDREDS MIGRANTS MEDITERRANEAN BOAT CARRYI,1
8184,rescuers,,WOMANS GPS APP GUIDES RESCUERS INJURED BIKER MARIN COUNTY SFGATE,1
8187,rescuers,,FEARS MISSING MIGRANTS MED RESCUERS SEARCH SURVIVORS BOAT CARRYING MANY 600 MIGRANTSÛ,1
8188,rescuers,,RESCUERS FIND SURVIVORS NEPAL EARTHQUAKE BURIED,1
8189,rescuers,"Paris, France",RESCUERS RECOVER BODY 37YEAROLD CALGARY MAN LAKE NEAR VULCAN Û,1
8190,rescuers,,FEARS MISSING MIGRANTS MED RESCUERS SEARCH SURVIVORS BOAT CARRYING MANY 600 MIGRANTSÛ,1
8191,rescuers,"Here, there and everywhere",VIDEO WERE PICKING BODIES WATER RESCUERS SEARCHING HUNDREDS MIGRANTS BBC NEWS,1
8195,riot,Belgrade,TO ALL THE MEATLOVING FEMINISTS OF THE WORLD RIOT GRILL HAS ARRIVED POP QUIZ WHICH PREFER FEM ART,0
8196,riot,India,STUART BROAD TAKES EIGHT BEFORE JOE ROOT RUNS RIOT AGAINST AUSSIES,0
8201,riot,"Cardiff, UK",PIPRHYS I PREDICT RIOT,1
8202,riot,,TEAMVODG DISCOVERED NICKCANNON LISTENBUY REALMANDYRAIN RIOT ITUNESMUSIC ITUNES Û BLOWMANDYUP,0
8203,riot,,TO ALL THE MEATLOVING FEMINISTS OF THE WORLD RIOT GRILL HAS ARRIVED ARTS,0
8204,riot,Bossland,RASCAL FLATTS RIOT TOUR ATLANTIC CITY BEACH CONCERTAUGUST 20 20152 TICKETS,0
8205,riot,World Wide Web,TO ALL THE MEATLOVING FEMINISTS OF THE WORLD RIOT GRILL HASÅÊARRIVED,0
8208,riot,"Uppsala, Sweden",SERIOUSLY TACTICAL RIOT HEADQUARTERS DISNEY MARVEL,0
8209,riot,East London,DANIRIOT KEEP EYE WELL LOOKING LOTS NEW TEAM MEMBERS COMING DAYSWEEKS,0
8210,riot,"Detroit, MI",TO ALL THE MEATLOVING FEMINISTS OF THE WORLD RIOT GRILL HAS ARRIVED POP QUIZ WHICH PREFER FEMINIST,0
8211,riot,,LIVEWORKSHOP SELFIE BOOTH RIOT KAPPA,1
8212,riot,,ACACIAPENN ILL START BIG ASS RIOT SEND JAIL TODAY MFS SHIDDDD,0
8213,riot,,RIOT KIT BAH PART NEW CONCEPT GEAR COMING AUTUMNWINTER MENSWEAR FASHION URBANFASHIONÛ,0
8214,riot,,ABRANCABALLERO DISCOVERED NICKCANNON LISTENBUY REALMANDYRAIN RIOT ITUNESMUSIC ITUNES Û BLOWMANDYUP,0
8215,riot,,I LIKED YOUTUBE VIDEO THORINS THOUGHTS RIOT SANDBOX MODE LOL,0
8216,riot,,STUART BROAD TAKES EIGHT BEFORE JOE ROOT RUNS RIOT AGAINST AUSSIES STUART BROAD TOOK CAREERBEST FIGURES 8,0
8217,riot,"Los Angeles, CA",RETWEETED SARAH SILVERMAN SARAHKSILVERMAN SOUNDTRACK WALK STARTS W TRACEY ULLMAN THEY DONT KNOW PERFECT,0
8218,riot,,TO ALL THE MEATLOVING FEMINISTS OF THE WORLD RIOT GRILL HAS ARRIVED,1
8219,riot,,AFTER TIME RIOT REALLY MAKE OFFICIAL SATAN TEEMO SKIN,0
8221,riot,"Montana, USA",I LIKED YOUTUBE VIDEO SICK RIOT SHIELD SLIDE SPOTS,0
8223,riot,"Utah, USA",BYTORRECILLA TORRECILLA WE ALWAYS INFO SECRET LOL GAME CHECK SECRET GET 600000 RIOT POINTS BIO,0
8224,riot,"Frankfort, KY",TRANSWOMEN DRAG QUEENS COLOR LEAD RIOT WELL KNOWN BUTCH LESBIAN USUALLY CREDITED INCITING,0
8225,riot,Los Angeles,EAC4AU YOU PREORDER FILM ITUNES AMP WATCH 915 YAY,0
8226,riot,United Kingdom,WITHOUT ALLY NEAR CANT USE SKILL HOW GET HIRED REALLY CAUSE MAKING EVERY RIOT STAFF MEMBER LOOK INCOMPETENT,0
8231,riot,In Space,POP QUIZ WHICH PREFER FEMINIST REVOLUTION FRIED RAVIOLIÅÊWITH PORCINI RICOTTAÛ,0
8232,riot,,TO ALL THE MEATLOVING FEMINISTS OF THE WORLD RIOT GRILL HAS ARRIVED OLIVIAMILES01,0
8234,riot,"Sligo and Galway, Ireland",DAVIDJORDAN88 STEPHANENNY EXCEPT DONT KNOW STARTED RIOT EVEN MAKES SENSE CREDIT PARTICULAR INDIVIDUALS,1
8235,riot,"Los Angeles, CA",TROLLKRATTOS JUAN CARLOS SALVADOR THE SECRET TIPS GET 100000 RIOT POINTS LOL CHECK SECRET BIO,0
8236,riot,Seattle,SOUTHEAST DIRT RIOT SERIES CROWNS CHAMPIONS SOUTHEAST DIRT RIOT SERIES CROWNS CHAMPIONSBLACKFOOT ID THE SO,0
8237,riot,Tipperary (Long Way) ,SWEETPEAS RUNNING RIOT ALLOTMENT BRIGHTENING RAINY DAY,1
8238,riot,Mumbai,STUART BROAD TAKES EIGHT BEFORE JOE ROOT RUNS RIOT AGAINST AUSSIES,0
8239,riot,Malang,RIOT POLICE INTERVENE SOUTHAMPTON VITESSE ARNHEM SUPPORTERS CLASH Û¢ FANS CLASH BUILDUP SECOND,1
8240,riot,,JWALKERLYLE DISCOVERED NICKCANNON LISTENBUY REALMANDYRAIN RIOT ITUNESMUSIC ITUNES Û BLOWMANDYUP,0
8241,riot,"San Francisco, CA",CRACKER WHITE RIOT NOWPLAYING,0
8242,rioting,hertfordshire.,BUT GOVERNMENT CARE POLICE STOP RIOTING EVENTUALLY PROTESTORS EVENTUALLY SKYSCRAPERS BECOME PLANTCOVERED,1
8243,rioting,Dublin,NEW DOCO TONIGHT 9PM SETANTA SPORTS IRELAND FREEVIEW THE LARGEST POLICE PRESENCE SOCCER GAME IRELAND STOP PREVENT RIOTING,0
8244,rioting,,ERIC CLAPTON SHOT SHERIFF 1974 GUESS MANY PEOPLE RIOTING RIGHT NONE,1
8245,rioting,Spare 'Oom,KILL VAL IM RIOTING EMMERDALE,0
8246,rioting,SURROUNDED BY WEEABOOS,MONEY CANT BUY HAPPINESS LIE TELL POOR PEOPLE KEEP RIOTING,1
8247,rioting,,BLOODY HELL ALREADY UPGRADED RIOTING HYPERBOLE SAINTSFC,1
8250,rioting,Australia,TWITTER COUNT RIOTING FINANCIAL COLLAPSE BRAZIL RIO2016,1
8251,rioting,,WOULD BLACK DUDE ANTIOCH WOULD RIOTING,0
8252,rioting,NYC,RUNJEWELS RECENTLY MET BBC DISCUSS RACE RELATIONS AMERICA AMP BENEFITS RIOTING LOVEISLOVE,0
8253,rioting,Vidalia GA,REUTERS PEOPLE LIKE CHARGED INEVITABLE RIOTING CONTRIBUTING LIES,0
8254,rioting,"Vista, CA",CINDY NOONANCINDYNOONANHEARTBREAK BALTIMORE RIOTING YAHISTORICAL UNDERGROUNDRAILRAOD,1
8256,rioting,Serva Fidem,LEEDS FAN RIOTING EMBRA LOWER TIER LEAGUE CUP FINAL DEE DUM,1
8257,rioting,,STILL RIOTING COUPLE HOURS LEFT I CLASS,1
8258,rioting,"Bellville, Ohio",CLOYDRIVERS PLENTY BLACK PEOPLE RIOTING TOSU CHAMPIONSHIP WELL,0
8259,rioting,trapped in America,EVACIDE THE FERGUSON RIOTS WORKED THIS NEXT TIME SAY RIOTING DOESNT CHANGE ANYTHING THERE FIXED,1
8261,rioting,A little house in the outback.,BBCNEWS THE ASS BRITISH INSURERS SAYS RIOTING COST INSURERS AMP163163MILLIONS BUT POLICE NUMBERS REDUCED BLIND FAT CONTR,1
8262,rioting,tri state,BHRAMABULL WATCH RUN THE JEWELS USE FACTS DEFEND RIOTING FERGUSON THE SOCIALLY MINDED DUO TAKES,1
8264,rioting,Upstate New York,I THINK TWITTER INVENTED KEEP US INSOMNIACS RIOTING WEE SMALL HOURS,0
8266,rioting,,BLUTZ10 PEOPLE ARENT RIOTING JUSTICE SERVED MURDERER BEHIND BARS SIMPLE NO JUSTICENO PEACE JUSTICEPEACE,1
8267,rioting,,STILL RIOTING GMAIL,0
8270,rioting,"Scotland, United Kingdom",JASALHAD BRIANBORU67 JIMSKIV92 HIJINKS1967 RIOTING,1
8271,rioting,,RYLEEDOWNS02 NEVAEHBURTON33 I DONT GET MONEY TOMORROW RIOTING,0
8274,rioting,,RT WHY SWEDEN ISNT VENEZUELA THERE DAYS RIOTING VENEZUELA RIOTS DIRECTED GRÛ,1
8276,rioting,Chicora ?? Oakland,DAVIDOLSZAK RIOTING HAPPY VALLEY PENN STATE LOSES,0
8278,rioting,,AELINRHEE GROUP MASCARA SMEARED GIRLS RIOTING HORRIFIC I THINK,1
8279,rioting,,THE LAST TIME HIGH PROFILE NAME DUE SIGNING NFFC CITY RIOTING WESLEY VERHOEK HOUSEHOLD NAME DONTPANIC,1
8280,rioting,"heart of darkness, unholy ?",GEORGOUS ALTERNATIVES LEGAL ALTERNATIVES PROTESTING RIOTING MAY PEACEFUL THING DEMONSTRATION,0
8283,rioting,"Colonial Heights, VA",HALLJH1720 I SICK CRIMINALS PARENTS FRIENDS RIOTING KILLED POLICE YOU DONT GIVE DAMN OFFICER,1
8284,rioting,,BLUTZ10 BUT RIOTING BEGAN PRIOR DECISION INDICTMENT YOURE REALLY MAKING SENSE POINTÛ,1
8285,rioting,India,THE ASHES TEST MATCH CURRENTLY INTERESTING STUPID CONGRESS RIOTING,1
8286,rioting,The Weird Part of Wonderland,PEOPLE RIOTING EVERYWHERE I THINK ID ONE USAMISAN LT3,1
8287,rioting,,FOOTBALL HOOLIGAN JAILED RIOTING GAME SCOTLAND ALREADY BANNED MATCHES ENGLAND UKNEWS,1
8288,rioting,Alabama,CINDY NOONANCINDYNOONANHEARTBREAK BALTIMORE RIOTING YAHISTORICAL UNDERGROUNDRAILRAOD,0
8289,rioting,A little house in the outback.,AM BBCNEWS THE ASS BRITISH INSURERS SAYS RIOTING COST INSURERS163MILLIONS BUT POLICE NUMBERS REDUCED BLIND FAT CONTROLLERS,1
8291,rioting,Cassadaga Florida,FA07AF174A71408 I LIVED AMP FAMILY LIVED COUNTRIES LOOTERS SHOT SIGHT RIOTING WASNT TOLERATED WHY,1
8292,rubble,"Columbus, Georgia",REFUSE LET LIFE REDUCED RUBBLE WHEN SHIT KEEPS PILING GET SHOVEL EXPIREHC,0
8294,rubble,"Minna, Nigeria",CHINAS STOCK MARKET CRASH ARE THERE GEMS IN THE RUBBLE CHINAÛªS STOCK MARKET CRASH SU VIA FORBES,0
8295,rubble,,IF GO NUCLEAR ARMS RACE GOING MAKE RUBBLE BOUNCE WINSTON CHURCHILL,0
8296,rubble,,ACCIONEMPRESA CHINAÛªS STOCK MARKET CRASH SUMMER SPARKED INTEREST BARGAIN HUNT GERENCIATODOS Å¨,1
8297,rubble,,ACCIONEMPRESA CHINAÛªS STOCK MARKET CRASH SUMMER SPARKED INTEREST BARGAIN HUNT GERENCIATODOS Å¨,0
8298,rubble,,MY PARENTS IMPULSIVE SOMETIMES I REMEMBER COMING HOME ROOM FILLED DUST AMP RUBBLE WANTED REDESIGNED,0
8300,rubble,,TURNING RUBBLE DISASTERS LEGO BRICKS BUILD HOUSES THIS ONE BELONGS CRAZYIDEASCOLLEGE,0
8301,rubble,"Accra,Ghana",360WISENEWS CHINAS STOCK MARKET CRASH ARE THERE GEMS IN THE RUBBLE,0
8304,rubble,World,FORBES CHINAS STOCK MARKET CRASH ARE THERE GEMS IN THE RUBBLE CHINAÛªS STOCK MARKET CRASH SUMMER HA,0
8309,rubble,"Dubai, UAE",FORBES EUROPE CHINAS STOCK MARKET CRASH ARE THERE GEMS IN THE RUBBLE,1
8310,rubble,,CHINAÛªS STOCK MARKET CRASH SUMMER SPARKED INTEREST BARGAIN HUNTERS BULLS BETTING REBOUND DÛ,0
8311,rubble,Phoenix Az,JASONPOPE2 JOHNFUGELSANG I DIDNT SAY I REFERRING MAIN 2 BUILDINGS 7 HIT RUBBLE,1
8312,rubble,Italy,CHINAS STOCK MARKET CRASH ARE THERE GEMS IN THE RUBBLE,0
8314,rubble,London,360WISENEWS CHINAS STOCK MARKET CRASH ARE THERE GEMS IN THE RUBBLE,1
8315,rubble,,JUN 2015 YEMENIS SEARCH SURVIVORS RUBBLE HOUSES OLD CITY SANÛªA FOLLOWING,1
8317,rubble,ON,CHINAS STOCK MARKET CRASH ARE THERE GEMS IN THE RUBBLE FORBESASIA,1
8318,rubble,"St. Louis, MO",STEVE BUSCEMI FIREFIGHTR B4 FAME AMP WORKD 12HR SHIFTS DIGGIN THRU WTC RUBBLE LOOKG 4 SURVIVORS,1
8320,rubble,United States,CHINAS STOCK MARKET CRASH ARE THERE GEMS IN THE RUBBLE TCOT P2 NEWS,0
8321,rubble,Spain - China - Latin America.,CHINAS STOCK MARKET CRASH ARE THERE GEMS IN THE RUBBLE CHINAÛªS STOCK MARKET CRASH SUMMER H FORBES,0
8324,rubble,"Chester, IL",I FOUND DIAMOND RUBBLE,0
8329,rubble,West Africa,TNN CHINAS STOCK MARKET CRASH ARE THERE GEMS IN THE RUBBLE,1
8330,rubble,"Calgary, AB, Canada",CHINAS STOCK MARKET CRASH ARE THERE GEMS IN THE RUBBLE ROIMENTOR YYCWALKS,1
8332,rubble,California,CHINAS STOCK MARKET CRASH ARE THERE GEMS IN THE RUBBLE,0
8334,rubble,Made Here In Detroit ,360WISENEWS CHINAS STOCK MARKET CRASH ARE THERE GEMS IN THE RUBBLE,1
8335,rubble,"Portland, OR",NEW POST CHINAS STOCK MARKET CRASH ARE THERE GEMS IN THE RUBBLE,0
8337,rubble,,CHINAS STOCK MARKET CRASH ARE THERE GEMS IN THE RUBBLE CHINAÛªS STOCK MARKET CRASH SUMMER SPARKED,0
8339,rubble,"Dallas, Tejas",PHOTO POSTAPOCALYPTICFLIMFLAM PRODDING AROUND RUBBLE,0
8341,rubble,"ATLANTA , GEORGIA ",360WISENEWS CHINAS STOCK MARKET CRASH ARE THERE GEMS IN THE RUBBLE,0
8344,ruin,| CA Û¢ GA  |,OKGABBY DAMN SUH DONT LET RUIN YEAR BRUH YEAR BETTER START CARPOOLING LIKE BACK DAY,0
8345,ruin,"Nashville, TN",IF I CANT RUIN MOOD I MAY LOST DIRECTION,0
8346,ruin,,I RUIN EVERYTHING,0
8347,ruin,Depok,QUOTE NEVER LET PROBLEMS RUIN FAITH,0
8348,ruin,London / Birmingham,IM ANXIOUS THOUGH MANY PPL WATCHING MEET MAKES UNCOMFORTABLE BUT I CANT LET THAT RUIN THE MOMENT,0
8349,ruin,texas,SMOKERS RUIN NEW CAR SMELL,0
8350,ruin,"Yulee, FL",CHRISDYSON16 JUST WAIT FRIENDS MTA RUIN SORRYBUTITSTRUE,0
8351,ruin,austin tx,IM REALLY SAD RED 7 CLOSING YUPPIES N TOURISTS RUIN EVERYTHING,0
8352,ruin,,ALWAYS GOTTA RUIN MOOD,0
8355,ruin,,I UNDERSTAND WANTING HANG GUY FRIENDS ILL GIVE SPACE DONT RUIN TRUST,0
8356,ruin,Garrett,LIKE EARTH WOULD WANT ANYBODY UNHAPPY DONT PURPOSELY RUIN SOMEBODY ELSES HAPPINESS,0
8360,ruin,followurDREAMS(& my instagram),FRESH DA SHOWER LOOKSS STILL LOVING NEW HAIR RUIN BRAND YES,0
8361,ruin,,SAVANNAHROSS4 SEE TRYNA RUIN LIFE,0
